id,id_str,created_at,media_url,url,type,language_code,bounding_box,country,country_code,user_loc,full_text,country_or_territory,CIME_geolocation_string,CIME_coordinates
1311218661177212928,1311218661177212928,2020-09-30 08:17:44,http://pbs.twimg.com/media/EjJeGLjVkAAFPK-.jpg,https://t.co/nPB4DSsh3w,photo,en,[0],-,AUS,Australia,b'Victoria heavy-handed on COVID fines: Eslake https://t.co/sXGy947QTXFor every 100000 people the government collected $89.90 in fines against $20.10 in the other statesMore evidence #vicpolice have a huge bully culture at the top.#springst #auspol #vicpol https://t.co/nPB4DSsh3w',Australia,"['Australia', 'Australia, Canton Santa Rosa de Yacuma, Santa Rosa, General José Ballivián Segurola, El Beni', 'Australia, Jagüey Grande, Matanzas']","[[-24.7761086, 134.755], [-12.7892966, -66.5223197], [22.500905, -81.1356126]]"
1311218644911702019,1311218644911702019,2020-09-30 08:17:40,http://pbs.twimg.com/media/EjJiZ7GUcAAWTB3.jpg,https://t.co/G8eSXzZoFH,photo,in,[0],-,ECU,,b'Bersama Kita Cegah Penularan covit-19..Giat Personil Polsek Pontianak Utara yang tergabung dalam Satgas \xe2\x80\x9cAman Nusa II- Penanganan Covid-19 Tahun 2020 melakukan himbauan pencegahan penyebaran covid -19 di Mall Ramayana di Jln. Tanjungpura Pontianak.Rabu sore (30/9) https://t.co/G8eSXzZoFH',Ecuador,"['Quito, Quito, Pichincha', 'Kita, Kayes', '北区', 'Gereja Penyebaran Injil, Jalan Jendral Ahmad Yani, Majalengka, Majalengka, Jawa Barat', 'Gereja Penyebaran Injil, Arie Lasut, Batu Kota, Kleak, Manado, Sulawesi Utara', 'Gereja Penyebaran Injil, Jalan R.A. Kartini, Sekolaq Muliaq, Kalimantan Timur']","[[-0.2201641, -78.5123274], [13.20698005, -9.388645713571428], [35.755838, 139.736687], [-6.8359629, 108.22996698634707], [1.5029726, 124.86684452401269], [-0.24567765, 115.78492680745708]]"
1311218615484547073,1311218615484547073,2020-09-30 08:17:33,http://pbs.twimg.com/media/EjJiYZCUYAEtcKo.jpg,https://t.co/0QsNo85NYK,photo,en,[0],-,IND,"Mysore, India",b'On eve of World Pharmacists Day Felicitation of Corona warriors function was inaugurated by *Sri C H Vijayashankar*  former minister for environment-Forests and former MP.  Chief guest: *Dr. Selvakumar Chief secretery* to CM govt of Karnataka. https://t.co/0QsNo85NYK',India,"['Mysuru, Mysuru taluk, Mysuru district, Karnataka']","[[12.3051828, 76.6553609]]"
1311218545724923909,1311218545724923909,2020-09-30 08:17:17,http://pbs.twimg.com/media/EjJiTTcXkAIKeKp.jpg,https://t.co/ERB6veUhKO,photo,en,[0],-,PAK,,b'Be strong! #Pakistani teenagers play #football as #COVID-19 situation eases https://t.co/TpPI6NhtAH via @INP for Latest News Updates https://t.co/ERB6veUhKO',Pakistan,"['پاکستان', 'Pakistani, شارع كْوَار, Al Wahda, آل نَهيان, أبوظبي, أبو ظبي', 'Pakistani, KN 2 Street, Kiyovu, Kigali, Akarere ka Nyarugenge, Umujyi wa Kigali', 'Football, Péronnes, Antoing, Hainaut, Wallonie', 'Football, Κατσικάς, Ιωάννινα, Δήμος Ιωαννιτών, Περιφερειακή Ενότητα Ιωαννίνων, Περιφέρεια Ηπείρου, Αποκεντρωμένη Διοίκηση Ηπείρου - Δυτικής Μακεδονίας', 'the football, Hardy, Lindon, Utah County, Utah', 'COVID, Sucre, Arena II, Manta, Manta, Manabí', '#covid, Bog Walk - White Hall Road, Hillside, Riversdale, Spanish Town, Saint Catherine, Middlesex County']","[[30.3308401, 71.247499], [24.4636356, 54.3826449], [-1.9432216, 30.0592577], [50.55002075, 3.4563466769661684], [39.6269418, 20.89156177780526], [40.38592785, -111.74618510239803], [-1.0477716, -80.6582902], [18.1625591, -76.94673044465068]]"
1311218507493904384,1311218507493904384,2020-09-30 08:17:08,http://pbs.twimg.com/media/EjJiNpIXcAE3BiH.jpg,https://t.co/14n7X0yuFy,photo,en,[0],-,UGA,"Kampala, Uganda",b'The closure of universities during the COVID-19 lockdown has got a number of student to think innovative as they make handcrafts and other vocational skill business. DETAILS: https://t.co/5EwLyG4tSk  #VisionUpdates https://t.co/14n7X0yuFy',Uganda,"['Kampala Capital City, Central Region']","[[0.3177137, 32.5813539]]"
1311218499499356161,1311218499499356161,2020-09-30 08:17:06,http://pbs.twimg.com/media/EjJiRtXU4AEj7Nd.jpg,https://t.co/xWP5bnnPSR,photo,el,[0],-,GRC,Athens,b'Covid-19: \xce\x95\xce\xbb\xcf\x80\xce\xb9\xce\xb4\xce\xbf\xcf\x86\xcf\x8c\xcf\x81\xce\xb1 \xce\xbd\xce\xad\xce\xb1 \xce\xb3\xce\xb9\xce\xb1 \xce\xb1\xce\xbd\xcf\x84\xce\xb9\xce\xb9\xce\xba\xcf\x8c \xcf\x86\xce\xac\xcf\x81\xce\xbc\xce\xb1\xce\xba\xce\xbf \xcf\x80\xce\xbf\xcf\x85 \xce\xb1\xce\xbd\xce\xb1\xcf\x80\xcf\x84\xcf\x8d\xcf\x83\xcf\x83\xce\xb5\xce\xb9 \xce\xb5\xce\xbb\xce\xbb\xce\xb7\xce\xbd\xce\xbf\xce\xb1\xce\xbc\xce\xb5\xcf\x81\xce\xb9\xce\xba\xce\xb1\xce\xbd\xce\xb9\xce\xba\xce\xae \xcf\x86\xce\xb1\xcf\x81\xce\xbc\xce\xb1\xce\xba\xce\xb5\xcf\x85\xcf\x84\xce\xb9\xce\xba\xce\xae \xce\xb5\xcf\x84\xce\xb1\xce\xb9\xcf\x81\xce\xb5\xce\xaf\xce\xb1 https://t.co/hI6II2sVI8 https://t.co/xWP5bnnPSR',Greece,"['Αθήνα, Δήμος Αθηναίων, Περιφερειακή Ενότητα Κεντρικού Τομέα Αθηνών, Περιφέρεια Αττικής, Αποκεντρωμένη Διοίκηση Αττικής', 'Athens-Clarke County Unified Government, Athens-Clarke County, Georgia', 'Athens County, Ohio']","[[37.9839412, 23.7283052], [33.9597677, -83.376398], [39.355589, -82.0610404]]"
1311218494634168320,1311218494634168320,2020-09-30 08:17:05,http://pbs.twimg.com/media/EjJiROaWkAAjyQ8.jpg,https://t.co/UNnPjWNAwl,photo,it,"[[14.1332005, 40.7920697], [14.3537026, 40.7920697], [14.3537026, 40.9161549], [14.1332005, 40.9161549]]",Italy,ITA,,b'Il virus ci rende silenziosi ...#fotografia #streetphoto #COVID19 #iPhone https://t.co/UNnPjWNAwl',Italy,-,-
1311218492574584832,1311218492574584832,2020-09-30 08:17:04,http://pbs.twimg.com/media/EjJiQ9UU4AAnpCb.jpg,https://t.co/yNcClVXC6n,photo,in,[0],-,ECU,,b'Bersama Kita Cegah Penularan covit-19..Giat Personil Polsek Pontianak Utara yang tergabung dalam Satgas \xe2\x80\x9cAman Nusa II- Penanganan Covid-19 Tahun 2020 melakukan sosialisasi pencegahan penyebaran covid -19 di Mall Ramayana di Jln. Tanjungpura Pontianak.Rabu sore (30/9) https://t.co/yNcClVXC6n',Ecuador,"['Quito, Quito, Pichincha', 'Kita, Kayes', '北区', 'Gereja Penyebaran Injil, Jalan Jendral Ahmad Yani, Majalengka, Majalengka, Jawa Barat', 'Gereja Penyebaran Injil, Arie Lasut, Batu Kota, Kleak, Manado, Sulawesi Utara', 'Gereja Penyebaran Injil, Jalan R.A. Kartini, Sekolaq Muliaq, Kalimantan Timur']","[[-0.2201641, -78.5123274], [13.20698005, -9.388645713571428], [35.755838, 139.736687], [-6.8359629, 108.22996698634707], [1.5029726, 124.86684452401269], [-0.24567765, 115.78492680745708]]"
1311218431988051969,1311218431988051969,2020-09-30 08:16:50,http://pbs.twimg.com/media/EjJiNaVWAAEVswM.jpg,https://t.co/QEn8V5bLt2,photo,en,[0],-,PSE,,b'#Israel approves law to limit protest during lockdown#IsraeliParliament #Covid19 https://t.co/mYIDCzjgeD https://t.co/QEn8V5bLt2',"Palestine, State of","['ישראל', 'Israel, Preston County, West Virginia', 'Israel, Municipio La Asunta, Provincia Sud Yungas, La Paz', 'centre médical COVID19, Quai Jean de Béthencourt, Centre Ville Rive Gauche, Rouen, Rouen, Seine-Maritime, Normandie, France métropolitaine', 'Triaje inicial de Urgencias provisional (CoViD19), Calle Real de Burgos, Puente Jardín, La Victoria, Valladolid, Valladolid, Castilla y León', 'Triaje inicial de Urgencias provisional (CoViD19), Calle de la Dulzaina, Las Viudas-Aramburu, Las Delicias, Valladolid, Valladolid, Castilla y León']","[[31.5313113, 34.8667654], [39.3181528, -79.8109014], [-16.1610089, -67.1505082], [49.4404016, 1.0754066], [41.6561774, -4.7177394], [41.6303043, -4.712253320328967]]"
1311218360483487744,1311218360483487744,2020-09-30 08:16:33,http://pbs.twimg.com/media/EjJfOTiWoAAMCVb.jpg,https://t.co/0olFQdzPpr,photo,ca,[0],-,ESP,Comunitat Valenciana,b'#COMDIGCV20 \xf0\x9f\x96\x8b  La Consellera de transpar\xc3\xa8ncia @RosaPerezGarijo inaugura el XII Congr\xc3\xa9s de Comunicaci\xc3\xb3 digital en la CV: Periodisme en temps de coronavirus.\xf0\x9f\x92\xac \xe2\x80\x9cLa transparencia y la calidad de la informaci\xc3\xb3n son fundamentales para generar confianza en las administraciones. https://t.co/0olFQdzPpr',Spain,"['Comunitat, Carrer del Forn, Turballos, Muro de Alcoy, el Comtat, Alacant / Alicante, Comunitat Valenciana', 'Comunitat Valenciana', 'La Valenciana, Badajoz, Tierra de Badajoz, Badajoz, Extremadura', 'La Valenciana, Villaescusa de Roa, Aranda de Duero, Castilla y León', 'La Valenciana, Jaca, La Jacetania, Huesca, Aragón']","[[38.8053791, -0.4413848], [39.6819591, -0.7654406], [38.7981242, -7.0608519], [41.7199792, -4.0308888], [42.5865697, -0.6709338]]"
1311218300924301313,1311218300924301313,2020-09-30 08:16:18,http://pbs.twimg.com/media/EjJg9uiU8AAsdKm.png,https://t.co/LjIIQpyFxK,photo,en,[0],-,ECU,,b'Even as life is gradually limping back to normal amid the #COVID threat a #Punjabi song was shot in the Valley which was once considered the second home of #Bollywood. Impressed by the hospitality of #Kashmiris Actor Yuvika Chaudhary said people are so calm &amp warm-hearted here. https://t.co/LjIIQpyFxK',Ecuador,"['COVID, Sucre, Arena II, Manta, Manta, Manabí', '#covid, Bog Walk - White Hall Road, Hillside, Riversdale, Spanish Town, Saint Catherine, Middlesex County', 'Punjabi, Tegernseer Landstraße, Siedlung am Perlacher Forst, Bezirksteil Südgiesing, München, Bayern', 'Punjabi, Kaukenberg, Kaukenberg, Paderborn, Paderborn, Kreis Paderborn, Nordrhein-Westfalen', 'Punjabi, Gliesmaroder Straße, Östliches Ringgebiet, Braunschweig, Niedersachsen', 'Bollywood, Notre-Dame-des-Landes, Châteaubriant-Ancenis, Loire-Atlantique, Pays de la Loire, France métropolitaine', 'le Bollywood, Rue Faillot, Centre-Ville, Les Cassoirs, Auxerre, Auxerre, Yonne, Bourgogne-Franche-Comté, France métropolitaine', 'Bollywood, Hollybrook Way, Heatherton, Derby, Derby, East Midlands, England', ""Kashmiri's Hospital, Bus Stand Road, Harigarh, Bakhshiwala, Sunam, Sunam Tahsil, Sangrur, Punjab"", ""Kashmiri's Hospital and Dental Clinic, Station Road, Harigarh, Bakhshiwala, Sunam, Sunam Tahsil, Sangrur, Punjab""]","[[-1.0477716, -80.6582902], [18.1625591, -76.94673044465068], [48.1009166, 11.5847712], [51.7206086, 8.8021167], [52.2767216, 10.5487134], [47.3493507, -1.7184227], [47.7950178, 3.5700544], [52.8925029, -1.5312257], [30.132953, 75.80699], [30.127038, 75.806146]]"
1311218208893030401,1311218208893030401,2020-09-30 08:15:56,http://pbs.twimg.com/media/EjJiAE9X0AAu1UA.jpg,https://t.co/tV9C3cUeNY,photo,en,[0],-,UGA,"Kampala, Uganda",b'\xe2\x80\x9cThey have a right to clear transparent and understandable information concerning the Covid-19 outbreak the actual danger and what is expected of them\xe2\x80\x9d @sarahkanyike @Mglsd_UG @FrankTumwebazek #IDOPUG2020 https://t.co/tV9C3cUeNY',Uganda,"['Kampala Capital City, Central Region']","[[0.3177137, 32.5813539]]"
1311218172180049922,1311218172180049922,2020-09-30 08:15:48,http://pbs.twimg.com/media/EjJh-qzVgAMUuhe.jpg,https://t.co/Z1b5InDkdJ,photo,en,[0],-,CAN,"Toronto, Ontario",b'THEY DONT CARE: Tokyo Olympics to Go on in 2021 Despite Coronavirus Says Vice-President https://t.co/DiiHP0AypX #Coronavirus #Olympics #Tokyo https://t.co/Z1b5InDkdJ',Canada,"['Toronto, Golden Horseshoe, Ontario']","[[43.6534817, -79.3839347]]"
1311218168749158400,1311218168749158400,2020-09-30 08:15:47,http://pbs.twimg.com/media/EjJh-DKVkAUtEeu.jpg,https://t.co/S6oXe2QrTp,photo,gu,[0],-,IND,"Mahesana, India",b'\xe0\xaa\x95\xe0\xaa\xbe\xe0\xaa\xb0\xe0\xab\x8d\xe0\xaa\xaf\xe0\xaa\x95\xe0\xab\x8d\xe0\xaa\xb0\xe0\xaa\xae@\xe0\xaa\xb5\xe0\xaa\xbf\xe0\xaa\xb8\xe0\xaa\xa8\xe0\xaa\x97\xe0\xaa\xb0: \xe0\xaa\x97\xe0\xab\x8d\xe0\xaa\xb0\xe0\xab\x81\xe0\xaa\xaa \xe0\xaa\xb5\xe0\xab\x80\xe0\xaa\xae\xe0\xaa\xbe\xe0\xaa\xa8\xe0\xaa\xbe 22 \xe0\xaa\x95\xe0\xab\x87\xe0\xaa\xb8\xe0\xab\x8b\xe0\xaa\xa8\xe0\xab\x81\xe0\xaa\x82 \xe0\xaa\xa8\xe0\xaa\xbf\xe0\xaa\xb0\xe0\xaa\xbe\xe0\xaa\x95\xe0\xaa\xb0\xe0\xaa\xa3 \xe0\xaa\xa5\xe0\xaa\xa4\xe0\xaa\xbe\xe0\xaa\x82 APMC \xe0\xaa\xa6\xe0\xab\x8d\xe0\xaa\xb0\xe0\xaa\xbe\xe0\xaa\xb0\xe0\xaa\xbe \xe0\xaa\x9a\xe0\xab\x87\xe0\xaa\x95 \xe0\xaa\xb5\xe0\xaa\xbf\xe0\xaa\xa4\xe0\xaa\xb0\xe0\xaa\xa3 https://t.co/sWHSdq0f9w https://t.co/S6oXe2QrTp',India,"['Mahesana, Mahesana District, Gujarat']","[[23.666667, 72.5]]"
1311218101971640321,1311218101971640321,2020-09-30 08:15:31,http://pbs.twimg.com/media/EjJhws_UMAIXmPE.jpg,https://t.co/C9GA3jB8mC,photo,en,[0],-,IND,"Rajahmundry, India",b'Anti larva spraying activities carried out by @RMCoffice sanitation staff to keep the city clean and prevent the spread of #COVID19.#swachsurvekshan2021 #swachhbharat #SwachhRajamahendravaram #RMCSS2021 #MyCleanIndia #RjyFightsCorona #RjyFightsCovid19 https://t.co/C9GA3jB8mC',India,"['Rajamahendravaram, Rajahmundry (Urban), Andhra Pradesh']","[[17.0050454, 81.7804732]]"
1311218082560585728,1311218082560585728,2020-09-30 08:15:26,http://pbs.twimg.com/media/EjJhMR3XgAItTAd.jpg,https://t.co/Imm0ycDtu3,photo,en,[0],-,AFG,Afghanistan,b'\xe2\x80\x9cYoung women of Afghanistan are key players in the economic recovery\xe2\x80\x9d said @DavidianAli UN Women Dept. Rep. in Afghanistan. \xe2\x80\x9cAccess to knowledge skills as well as seed capital will help young women build back what Covid-19 has taken.\xe2\x80\x9d#PoweringChange https://t.co/Imm0ycDtu3',Afghanistan,"['افغانستان', 'أفغانستان, دبي, دبي', 'Afghanistan, Marcelo Green Village Phase 8, Marcelo Green, Parañaque, Fourth District']","[[33.7680065, 66.2385139], [25.2333938, 55.174389025091465], [14.4842136, 121.040103]]"
1311218002445074432,1311218002445074432,2020-09-30 08:15:07,http://pbs.twimg.com/media/EjJhxDUXcAA9KAP.jpg,https://t.co/NbXx1E5pOu,photo,en,[0],-,RWA,Kigali-RWANDA,b'CHUK being the leading Public Hospital with average of 1000 patients frequency at daily basis come at the frontline of fighting to stop the Covid 19 propagation https://t.co/NbXx1E5pOu',Rwanda,"['Kigali, Akarere ka Nyarugenge, Umujyi wa Kigali']","[[-1.950851, 30.061507]]"
1311217999865675777,1311217999865675777,2020-09-30 08:15:07,http://pbs.twimg.com/media/EjJhzRRXkAEqbeV.jpg,https://t.co/3mWYlxYA1P,photo,es,[0],-,ESP,"Murcia, España",b'Investigadores de la @UPCTnoticias han comenzado a desarrollar un dispositivo port\xc3\xa1til de bajo coste para detectar y amplificar las se\xc3\xb1ales electroqu\xc3\xadmicas que generan los cambios gen\xc3\xb3micos derivados de la infecci\xc3\xb3n del Covid-19. https://t.co/3mWYlxYA1P',Spain,"['Murcia, Área Metropolitana de Murcia, Región de Murcia, Región de Murcia']","[[37.9923795, -1.1305431]]"
1311217971193286656,1311217971193286656,2020-09-30 08:15:00,http://pbs.twimg.com/media/EinofyeUcAIZCIH.jpg,https://t.co/iu0AkJiU6A,photo,en,[0],-,GBR,"London, UK",b'Weve been pioneering innovations in #communication #CommunityEngagement &amp #accountability (CCEA) for over a decade. But #COVID19 provided its own challenges. Thanks to @H2H_network \xe2\x80\x93 weve been assisting #Sudan &amp #Zimbabwe in the response: https://t.co/YezTlz8Fqq #Commisaid https://t.co/iu0AkJiU6A',United Kingdom,"['London, Greater London, England', 'City of London, Greater London, England', 'London, London, Southwestern Ontario, Ontario']","[[51.5073219, -0.1276474], [51.5156177, -0.0919983], [42.9836747, -81.2496068]]"
1311217971088547840,1311217971088547840,2020-09-30 08:15:00,http://pbs.twimg.com/media/EjJgQ5dWoAI7cvI.jpg,https://t.co/pLdGcHIjnH,photo,en,[0],-,PAK,Pakistan,b'Pakistan reports 747 COVID-19 cases in one dayhttps://t.co/VR5mFDJcTj#CoronavirusPakistan https://t.co/pLdGcHIjnH',Pakistan,"['پاکستان', 'باكستان, دبي, دبي', 'Pakistan, Annex 5, Parañaque, Fourth District']","[[30.3308401, 71.247499], [25.23075195, 55.17584859215857], [14.4853915, 121.0326671]]"
1311217948896440320,1311217948896440320,2020-09-30 08:14:54,http://pbs.twimg.com/media/EjJfuWcWkAAaiNl.jpg,https://t.co/jwBk9U3JnA,photo,en,[0],-,GBR,Lancashire and Europe,b'We have hope for the UK because of #NHS and #SocialCare front-line workers. #Community Groups Delivery Drivers Transport staff Refuse collectors. Public spirited citizens caring for neighbours. Volunteers for Vaccine trials. All DESPITE the actions of this Government. #Covid19 https://t.co/jwBk9U3JnA',United Kingdom,"['Lancashire, Lancashire, North West England, England']","[[53.8611703, -2.5650887919475496]]"
1311217856978198530,1311217856978198530,2020-09-30 08:14:33,http://pbs.twimg.com/media/EjJhsTwU8AITjYu.jpg,https://t.co/8Hr9fPrVoZ,photo,pt,[0],-,PRT,Portugal,b'Covid-19 bloqueou 2 a 3 milh\xc3\xb5es de pessoas nas fronteiras https://t.co/EWRQcwj1fY https://t.co/8Hr9fPrVoZ',Portugal,"['Portugal', 'Portugal, São Marcos da Serra, Silves, Faro, Algarve, Algarve', 'Portugal, Huambo, Huambo']","[[40.0332629, -7.8896263], [37.4005123, -8.3156107], [-12.672778, 15.609444]]"
1311217718197182464,1311217718197182464,2020-09-30 08:13:59,http://pbs.twimg.com/media/EjJhjBNXgAE-gwo.jpg,https://t.co/ab950Pt7tD,photo,de,[0],-,SGP,,b'Geht zum Essen ins Flugzeug!Wie Singapore Airlines die Corona-Krise \xc3\xbcberstehen willMehr unter https://t.co/x9TFYISgqc https://t.co/ab950Pt7tD',Singapore,"['Singapore, Central']","[[1.2904753, 103.8520359]]"
1311217708050993152,1311217708050993152,2020-09-30 08:13:57,http://pbs.twimg.com/media/EjJhgTFVgAAjmii.jpg,https://t.co/ff19kk1UXr,photo,en,[0],-,POL,,b'On September 30 2020 at about 1:03 PM PMSg Rey S Vicente PCAD PNCO conducted RECORIDA on Municipal Ordinances in relation to COVID-19 particularly on Mandatory use of Face shield at Barangay Poblacion Mahinog Camiguin.#WeFightAsOne#PNPChiefPikoyCascolan https://t.co/ff19kk1UXr',Poland,"['województwo pomorskie', 'Polícia Militar Estado São Paulo, Avenida Senador Teotônio Vilela, Interlagos, Socorro, São Paulo, Região Imediata de São Paulo, Região Metropolitana de São Paulo, Região Geográfica Intermediária de São Paulo, São Paulo, Região Sudeste', 'Polícia Militar, Rua Antônio Febraio Filho, Parque das Nações Unidas, Grajaú, São Paulo, Região Imediata de São Paulo, Região Metropolitana de São Paulo, Região Geográfica Intermediária de São Paulo, São Paulo, Região Sudeste', 'Mahinog, Camiguin, Northern Mindanao']","[[54.24556, 18.1099], [-23.70182285, -46.70111617109262], [-23.72929115, -46.694920754062196], [9.1548936, 124.7840906]]"
1311217674937077760,1311217674937077760,2020-09-30 08:13:49,http://pbs.twimg.com/media/EjJhhp5WkAAcekw.jpg,https://t.co/YJYsGghUus,photo,fr,[0],-,FRA,"Tours, France",b'Premi\xc3\xa8re soir\xc3\xa9e de d\xc3\xa9pistage Covid sur le campus Grandmont en pr\xc3\xa9sence du SSU et des \xc3\xa9tudiants relais sant\xc3\xa9. Prochain rdv le 6 octobre de 17h \xc3\xa0 20h #COVID19 @Univtours https://t.co/jhKpLPxmYz https://t.co/YJYsGghUus',France,['France métropolitaine'],"[[46.603354, 1.8883335]]"
1311217560944336898,1311217560944336898,2020-09-30 08:13:22,http://pbs.twimg.com/media/EjJhaxJXkAAtiky.jpg,https://t.co/vjEgSU2UMh,photo,pt,[0],-,PRT,Portugal,b'Covid-19: Alemanha regista 1.798 casos nas \xc3\xbaltimas 24 horas - https://t.co/6YNfWL9lAP https://t.co/vjEgSU2UMh',Portugal,"['Portugal', 'Portugal, São Marcos da Serra, Silves, Faro, Algarve, Algarve', 'Portugal, Huambo, Huambo']","[[40.0332629, -7.8896263], [37.4005123, -8.3156107], [-12.672778, 15.609444]]"
1311217544691417088,1311217544691417088,2020-09-30 08:13:18,http://pbs.twimg.com/media/EjJhFauXkAAY9sb.jpg,https://t.co/wcBaQifo5z,photo,es,[0],-,ESP,Granada,b'#UGT #Granada recuerda de cara a este #1deoctubreD\xc3\xadadelMayor a las v\xc3\xadctimas de #COVID19 y pide capacidad de respuesta ante esta crisis sanitaria  https://t.co/F6R4ZVOabu https://t.co/wcBaQifo5z',Spain,"['Granada, Andalucía', 'Granada, Comarca de la Vega de Granada, Granada, Andalucía', 'Grenada']","[[37.388830999999996, -3.2393183880901955], [37.183054, -3.6021928], [12.1360374, -61.6904045]]"
1311217516572803072,1311217516572803072,2020-09-30 08:13:11,http://pbs.twimg.com/media/EjJhYe4WsAESJH6.jpg,https://t.co/1DlC3sDL2H,photo,en,[0],-,GBR,,b'\xe2\x80\x98Riverdale\xe2\x80\x99 \xe2\x80\x98Batwoman\xe2\x80\x99 Shut Down Over Testing Delays in British Columbia https://t.co/MmpuyKFamm https://t.co/1DlC3sDL2H',United Kingdom,"['British, Aldergrove, Lisburn, County Antrim, Northern Ireland', 'British, Varteg, Blaenavon, Torfaen, Cymru / Wales', 'The British, Iron Acton, Iron Acton, South Gloucestershire, South West England, England', 'British Columbia', 'Colombia', 'Columbia, Richland County, South Carolina', 'Columbia County, Florida']","[[54.6631376, -6.228198934550507], [51.7252449, -3.0811001], [51.5517625, -2.4347462], [55.001251, -125.002441], [2.8894434, -73.783892], [34.0007493, -81.0343313], [30.1935988, -82.6327488]]"
1311217477809037317,1311217477809037317,2020-09-30 08:13:02,http://pbs.twimg.com/media/EjJhWOsXcAIBVzZ.jpg,https://t.co/FPStYMDtlh,photo,en,[0],-,GBR,"West Hampstead, London NW6",b'Not long now until our team will be getting muddy (safely) to support charity during Covid-19 at the #AgentsLoveMudChallenge! Find out how you can help us support local communities here &gt&gt  https://t.co/nivQnilWoW https://t.co/FPStYMDtlh',United Kingdom,"['Hampstead, London, Greater London, England', 'London, Greater London, England']","[[51.5580835, -0.1737206], [51.5073219, -0.1276474]]"
1311217463074476032,1311217463074476032,2020-09-30 08:12:59,http://pbs.twimg.com/media/EjJhVBFWoAAGTD-.jpg,https://t.co/dtMdUAgPYn,photo,tr,[0],-,TUR,istanbul,b'Covid yivasi kartal adliyesindeyim halk\xc4\xb1n\xc4\xb1z\xc4\xb1 helal edin https://t.co/dtMdUAgPYn',Turkey,"['İstanbul, Beyazıt Meydanı, Beyazıt Mahallesi, İstanbul, Marmara Bölgesi', 'İstanbul, İstanbul, Marmara Bölgesi', 'İstanbul, Marmara Bölgesi']","[[41.0096215, 28.9651867], [41.0096334, 28.9651646], [41.0766019, 29.052495]]"
1311217298733248512,1311217298733248512,2020-09-30 08:12:19,http://pbs.twimg.com/media/EjJhLyFXcAEjteL.png,https://t.co/BVcIlxryzo,photo,en,[0],-,QAT,"Doha, Qatar",b'Israel passes law to limit protests during coronavirus lockdown https://t.co/Z5pEpInGnJ https://t.co/BVcIlxryzo',Qatar,['الدوحة'],"[[25.2856329, 51.5264162]]"
1311217295419740161,1311217295419740161,2020-09-30 08:12:19,http://pbs.twimg.com/media/EjJhLduXYAE_K-Y.jpg,https://t.co/5RUus75HlF,photo,en,[0],-,USA,"New York, USA",b'A dismal presidential debate will leave voters unimpressed - https://t.co/YE3bjKSehI dismal presidential debate will leave voters unimpressedA dismal presidential debate will leave voters unimpressed https://t.co/5RUus75HlF',United States,"['New, Owen County, Kentucky', 'York, York, Pennsylvania']","[[38.4278468, -84.8105037], [39.962398, -76.727392]]"
1311217231863271425,1311217231863271425,2020-09-30 08:12:03,http://pbs.twimg.com/media/EjJhHxNU0AEG7fT.jpg,https://t.co/KFQ91l5Ii5,photo,in,[0],-,IDN,,b'Bhabinkamtibmas Desa Karangmekar Aiptu Lili Gozali melaksanakan kegiatan patroli lingkungan sekaligus memberikan himbauan/Woro-wowo kepada warga selalu menggunakan masker jaga jarak dan rajin mencuci tangan sebagai Kebiasaan Baru guna mencegah Covid-19 Rabu (30/09/2020) https://t.co/KFQ91l5Ii5',Indonesia,"['Karangmekar, Tasikmalaya, Jawa Barat', 'Karangmekar, Cimahi, Jawa Barat', 'Karangmekar, Karawang, Jawa Barat']","[[-7.6263114, 108.1446088], [-6.8901982, 107.5516434], [-6.2355252, 107.2591837]]"
1311217126468988928,1311217126468988928,2020-09-30 08:11:38,http://pbs.twimg.com/media/EjJhBvoXcAA08nT.jpg,https://t.co/93teGcnFtW,photo,en,[0],-,COD,Banana Republic TheNetherlands,b'Has #Merkel installed her FEMA camps yet?Chief Science Officer for Pfizer Says Second Wave Faked on False-Positive #COVID19 Tests Pandemic is Over https://t.co/c9awi4JPC3https://t.co/c9awi4JPC3 https://t.co/6SDoYnzacS https://t.co/93teGcnFtW',"Congo, The Democratic Republic of the","['Banana, Moanda, Kongo-Central', 'Banana, Kiambu, Central Kenya', 'Banana, Queensland', 'Banana Republic, Điện Biên Phủ, Saigon Pearl, Phường 22, Quận Bình Thạnh', 'Republic County, Kansas', 'Republic, Republic County, Kansas', 'Republic, Ferry County, Washington']","[[-6.0062686, 12.4002815], [-1.1736827, 36.7575458], [-24.472793, 150.1279004], [10.7948675, 106.7214014], [39.8266503, -97.6580834], [39.923621, -97.82171], [48.6482183, -118.7378067]]"
1311217107326042115,1311217107326042115,2020-09-30 08:11:34,http://pbs.twimg.com/media/EjJhArMU0AAiPHa.jpg,https://t.co/KM9VrsIQdr,photo,en,[0],-,USA,"Kuala Lumpur, Malaysia",b'Sandakan limits vehicle entries from 4 virus red zones https://t.co/NwwN57UgTC https://t.co/KM9VrsIQdr',United States,"['Kuala, Maui County, Hawaii', 'Kuala, Bireuen', 'Kuala, Singkawang, Kalimantan Barat', 'Kuala Lumpur', 'Federal Territory of Kuala Lumpur', 'Lumpur, Gresik, Gresik, Jawa Timur', 'Malaysia', 'ماليزيا, دبي, دبي', 'Malaysia, San Antonio Valley 10 and 11, Parañaque, Fourth District']","[[21.1350826, -156.730543], [5.2335087, 96.72018980698466], [0.9128732, 108.9591156], [3.1516964, 101.6942371], [3.1526589, 101.7022205], [-7.1510268, 112.6449129], [4.5693754, 102.2656823], [25.2330853, 55.18324970603023], [14.4778989, 121.0327206]]"
1311217015575715840,1311217015575715840,2020-09-30 08:11:12,http://pbs.twimg.com/media/EjJg7VoXcAAzWf5.jpg,https://t.co/vp4vJCJefX,photo,en,[0],-,GBR,"Nottingham, England",b'Covid: MPs to vote on renewing emergency powers https://t.co/drtDa1mrKy https://t.co/vp4vJCJefX',United Kingdom,"['City of Nottingham, East Midlands, England']","[[52.9534193, -1.1496461]]"
