id,id_str,created_at,media_url,url,type,language_code,bounding_box,country,country_code,user_loc,full_text,country_or_territory,CIME_geolocation_string,CIME_coordinates
1311135710473117697,1311135710473117697,2020-09-30 02:48:07,http://pbs.twimg.com/media/EjIW-U5UYAIxD1h.jpg,https://t.co/j8gxwnljrY,photo,in,[0],-,IDN,,b'Himbauan penegakan disiplin protokol kesehatan kepada warga masyarakat untuk selalu menggunakan masker  guna untuk pencegahan penyebaran Covid 19 di wilayah Kec Bendosari terus digiatkan agar warga disiplin menerapkan adaptasi kebiasaan baru di masa KLB covid 19 https://t.co/j8gxwnljrY',Indonesia,"['WILAYAH, Cempaka, Tegal, Jawa Tengah', 'Kec. Kelapa Lima, Kupang, Nusa Tenggara Timur', 'Masa Little Italy, Ølbycenter, Karlemoseparken, Skyttehuse, Køge, Køge Kommune, Region Sjælland', 'Kasenga Airport, RN35, Kasenga, Haut-Katanga', 'KEC, Leopoldstraße, Dörflas, Marktredwitz, Landkreis Wunsiedel im Fichtelgebirge, Bayern', 'KEC, Fikentscherstraße, Dörflas, Marktredwitz, Landkreis Wunsiedel im Fichtelgebirge, Bayern', 'Pura Masa, Jalan Nakula, Lingk. Banjar Mantri, Kel. Cilinaya, Kota Mataram, Kec. Selaparang, Nusa Tenggara Barat', 'Metz, Metz, Moselle, Grand Est, France métropolitaine', 'Masa küla, Saaremaa vald, Saare maakond', 'Massa, Massa-Carrara, Toscana']","[[-7.185185349999999, 109.07036257452859], [-10.1505144, 123.6303169], [55.4792288, 12.1747823], [-10.35499755, 28.617354663495618], [50.0003964, 12.08776966920724], [50.000936100000004, 12.088459230453559], [-8.5912876, 116.122291], [49.1196964, 6.1763552], [58.34487195, 22.679288540038854], [44.0359323, 10.1395519]]"
1311135619607916544,1311135619607916544,2020-09-30 02:47:46,http://pbs.twimg.com/media/EjIW5LEXgAEZs3X.jpg,https://t.co/uGkfVrbfMT,photo,es,[0],-,ESP,,b'Equipos actuales en Galar (incluyendo DLC). Mi equipo para Las Nieves de la Corona est\xc3\xa1 casi completo s\xc3\xb3lo faltan Absol y Decidueye.El equipo rudo pienso usarlo alg\xc3\xban d\xc3\xada en competitivo cuando Zarude sea liberado en combates https://t.co/uGkfVrbfMT',Spain,"['Galar, Navarra - Nafarroa, Navarra - Nafarroa', 'Corona, Riverside County, California']","[[42.7597271, -1.6974581], [33.8752945, -117.5664449]]"
1311135592084844546,1311135592084844546,2020-09-30 02:47:39,http://pbs.twimg.com/media/EjIWvOdXsAIVSCF.jpg,https://t.co/NsnXsYmJQ1,photo,en,[0],-,USA,"Wisconsin, USA",b'Chris Christie talking about Biden and Trump losing their cool like he didn\xe2\x80\x99t start COVID at a Cubs game https://t.co/NsnXsYmJQ1',United States,['Wisconsin'],"[[44.4308975, -89.6884637]]"
1311135590256193536,1311135590256193536,2020-09-30 02:47:39,http://pbs.twimg.com/media/EjIW3V3WsAAtupQ.jpg,https://t.co/9ab9DDiXO8,photo,es,[0],-,URY,,b'Comandos Covid Vecinales reciben Kits de equipos biom\xc3\xa9dicos para https://t.co/Lnx9PJHdBm v\xc3\xada @PrensaLibreIlo https://t.co/9ab9DDiXO8',Uruguay,"[""Equipo's, Doctor Enrique Muñoz, Villa Dolores, Parque Batlle, Montevideo, Montevideo""]","[[-34.9146446, -56.15770047343725]]"
1311135548870987781,1311135548870987781,2020-09-30 02:47:29,http://pbs.twimg.com/media/EjIWzToWkAALg63.jpg,https://t.co/BmSutmt9Wn,photo,es,[0],-,ECU,"Portoviejo, Ecuador ",b'Durante la jornada se realizaron toma de presi\xc3\xb3n arterial pruebas r\xc3\xa1pidas de #Covid_19ec. Entre los donantes estuvo @TitoNiltonM Gobernador de Manab\xc3\xad y donde se logr\xc3\xb3 captar 124 unidades de sangre. @Salud_CZ4 @LauraGomezCoba #ActivadosPorLaSalud #YoMeCuido https://t.co/BmSutmt9Wn',Ecuador,"['Portoviejo, Portoviejo, Manabí']","[[-1.0528066, -80.4534269]]"
1311135427190042627,1311135427190042627,2020-09-30 02:47:00,http://pbs.twimg.com/media/EjH14uFX0AcO07Z.png,https://t.co/6h1tuQPAVL,photo,es,[0],-,CHN,Ciudad de México,b'Los muertos por COVID-19 en el mundo rebasan el mill\xc3\xb3n. La Organizaci\xc3\xb3n Mundial de la Salud dijo que la pandemia ya lleg\xc3\xb3 a un \xe2\x80\x9cpunto cr\xc3\xadtico\xe2\x80\x9d. M\xc3\xa9xico se encuentra en el 4\xc2\xba lugar del mundo con 77163 muertes. #COVID-19 #OMB #OMS #Noticias https://t.co/6h1tuQPAVL',China,"['巢湖市 (Chaohu), 安徽省', 'La Ciudad, Pueblo Nuevo, Durango', 'Ciudad de México']","[[31.627503, 117.8842395], [23.7321711, -105.6899702], [19.4326296, -99.1331785]]"
1311135280246796288,1311135280246796288,2020-09-30 02:46:25,http://pbs.twimg.com/media/EjIVjkcWoAA9FwA.jpg,https://t.co/OKvlW3u1Nx,photo,en,[0],-,FRA,,b'This photo really says a lot about COVID posture @FLOTUS without mask and @DrBiden with. Sometimes actions says a lot more than words #debates #Debates2020 https://t.co/OKvlW3u1Nx',France,"['Lot, Occitanie, France métropolitaine', 'לוד, לוד, נפת רמלה, מחוז המרכז', 'לוד, נפת רמלה, מחוז המרכז']","[[44.624991800000004, 1.6657742169753669], [31.9489012, 34.8884857], [31.9489012, 34.8884857]]"
1311135123279142918,1311135123279142918,2020-09-30 02:45:47,http://pbs.twimg.com/media/EjIWbxMXcAENOIi.jpg,https://t.co/b5e3d1ONSR,photo,en,[0],-,PAK,"Shabqadar fort, KPK",b'AAReady to Welcome to the Students1st day after Covid-19 https://t.co/b5e3d1ONSR',Pakistan,"['Shabqadar, چارسدہ, Peshāwar District, خیبر پښتونخوا']","[[34.2146534, 71.5559253]]"
1311135075204030465,1311135075204030465,2020-09-30 02:45:36,http://pbs.twimg.com/media/EjIWYlJXkAIY2MC.png,https://t.co/WrVCeAfqZD,photo,es,[0],-,KOR,"San Salvador, El Salvador",b'#Debates2020 Finaliza el primer debate presidencial de Estados Unidos entre Donald Trump y Joe Biden. Econom\xc3\xada manifestaciones racismo y #coronavirus fueron parte del primero de tres encuentros entre ambos candidatos. \xf0\x9f\x91\x89 https://t.co/ZJTHvZ9Z3O https://t.co/WrVCeAfqZD',"Korea, Republic of","['대한민국', 'El Salvador']","[[36.638392, 127.6961188], [13.8000382, -88.9140683]]"
1311135023341301760,1311135023341301760,2020-09-30 02:45:23,http://pbs.twimg.com/media/EjIWWVxU4AEhebO.jpg,https://t.co/fspj86A91B,photo,in,[0],-,IDN,,b'Penegakan  protokol kesehatan guna mencegah penyebaran Covid 19 di Wilayah Kec. Tawangsari terus digalakkan di wilayah kecamatan Tawangsari guna memnghambat penyebaran covid 19 di wilayah Sukoharjo https://t.co/fspj86A91B',Indonesia,"['WILAYAH, Cempaka, Tegal, Jawa Tengah', 'Wilayah Kecamatan Pasimasunggu Timur, Sulawesi Selatan', 'Kecamatan, Kelinjau Ilir, Kalimantan Timur', 'kecamatan, Sembulang Pantai, Batam, Kepulauan Riau', ', Jalan Profesor Dokter Soepomo SH, RW 15, Daerah Khusus Ibukota Jakarta']","[[-7.185185349999999, 109.07036257452859], [-7.09322605, 120.73912287140801], [0.4248395, 116.6844286], [0.8493748, 104.2619318], [-6.2320008, 106.845368]]"
1311135018346000384,1311135018346000384,2020-09-30 02:45:22,http://pbs.twimg.com/media/EjIWWN2XYAA7QI5.jpg,https://t.co/yRu9bX4WCu,photo,es,[0],-,SLV,"Santa Tecla, La Libertad.",b'Concluye el #Debate2020 entre el presidente #DonaldTrump y el dem\xc3\xb3crata #JoeBiden. Los temas a discutir fueron la pandemia del #COVID19 el futuro del Tribunal Supremo tensiones raciales econom\xc3\xada y futuro de los #EstadosUnidos. https://t.co/yRu9bX4WCu',El Salvador,['La Libertad'],"[[13.7448086, -89.36115052649168]]"
1311135015120535554,1311135015120535554,2020-09-30 02:45:21,http://pbs.twimg.com/media/EjIWUfKX0AEUsRj.jpg,https://t.co/3OBm8DAGQg,photo,es,[0],-,URY,,b'CDI Tamare Nuestros h\xc3\xa9roes que vencen d\xc3\xada a d\xc3\xada a la COVID-19 y llevan vida y salud al m\xc3\xa1s necesitado  dibujando una sonrisa de esperanza en sus rostros. GRANDE MI CUBA Y SUS PROFESIONALES DE LA SALUD.@Cubacooperazul@Cubacoopera_Ve3 @cubacooperaveZ2 #Cubacoopera#CubaEsSalud https://t.co/3OBm8DAGQg',Uruguay,"['La Sonrisa, Maldonado', 'La Sonrisa, Santa Inés, Parroquia Moroturo, Municipio Urdaneta, Lara, Región Centroccidental', 'La Sonrisa, Ataco, Tolima', 'Via Sonrisa, Esperanza, Yorba Linda, Orange County, California', 'Sonrisa, Las Cruces, Doña Ana County, New Mexico', 'Esperanza, Puebla', 'Esperanza, Agusan del Sur, Caraga', 'La Esperanza, Quetzaltenango', 'Sus-centro de Salud, Matro Saragosin, Conjunto Virgen de Calderón, Calderon, Quito, Pichincha', 'Esperanza, Daguao, Naguabo, Puerto Rico', 'Esperanza, Ranchuelo, Villa Clara', 'Sus, Oloron-Sainte-Marie, Pyrénées-Atlantiques, Nouvelle-Aquitaine, France métropolitaine', 'سوسة, محمد معروف, معتمدية سوسة المدينة, ولاية سوسة', 'السويس, الغربية', 'Spirit of Saint Louis Airport, Beechcraft Avenue, Chesterfield, Saint Louis County, Missouri', 'Antonio Guiteras Holmes (Sus restos nunca estuvieron en este lugar), Calle 10, Alturas del Vedado, Nuevo Vedado, La Habana', 'United States', 'Michigan', '三重県', 'Mi Cuba, Los Arabos, Matanzas', 'Cuba', 'La Cuba, Maestrazgo, Teruel, Aragón', 'Juba, Central Equatoria']","[[-34.8916321, -54.9713959], [10.602864, -69.3064995], [3.5019955, -75.3290121], [33.8896135, -117.7691851], [32.3146315, -106.80704238707185], [18.8572371, -97.34992916303517], [8.6341255, 125.49949923360425], [14.8692299, -91.57127969229603], [-0.2739319, -78.5151915], [18.2184438, -65.6896373], [22.4452261, -80.0968761], [43.3070291, -0.7653504], [35.8288175, 10.6405392], [29.974498, 32.537086], [38.6625335, -90.64594490865258], [23.1233767, -82.4009744], [39.7837304, -100.4458825], [43.6211955, -84.6824346], [34.7339685, 136.5154489], [22.654387, -80.5629319], [23.0131338, -80.8328748], [40.5916447, -0.2981642], [4.8472017, 31.5951655]]"
1311134964877078528,1311134964877078528,2020-09-30 02:45:09,http://pbs.twimg.com/tweet_video_thumb/EjIWTE3WAAM5ZLI.jpg,https://t.co/VDBhhdVNGK,photo,en,[0],-,USA,"Brooklyn, NY",b'@BrandonABC13 I was looking for a new city to move to until Covid came around so maybe I need a whole new country instead and should consider Canada. Lol. https://t.co/VDBhhdVNGK',United States,"['Brooklyn, Orange, New York', 'Brooklyn, Poweshiek County, Iowa', 'Brooklyn, Saint Clair, Illinois']","[[40.6501038, -73.9495823], [41.7336092, -92.445463], [38.657181, -90.1670585]]"
1311134928461938688,1311134928461938688,2020-09-30 02:45:01,http://pbs.twimg.com/media/EjIWMQ5VkAA0zdg.jpg,https://t.co/rBQERN2VkB,photo,es,[0],-,MEX,"Polanco, Ciudad de México",b'CONCURSO DE FOTOGRAF\xc3\x8dACovid-19 / Tu mirada1er lugar - PrimariaAchille MART\xc3\x8dNEZ - CM1F https://t.co/rBQERN2VkB',Mexico,"['Polanco, Calle Arquímedes, Miguel Hidalgo']","[[19.43353, -99.190915]]"
1311134835889508358,1311134835889508358,2020-09-30 02:44:39,http://pbs.twimg.com/media/EjIWLbWVoAAFarI.jpg,https://t.co/HzTYWKSrXq,photo,hi,[0],-,IND,Mumbai,b'\xe0\xa4\x9c\xe0\xa4\xaf\xe0\xa4\xaa\xe0\xa5\x81\xe0\xa4\xb0 \xe0\xa4\xae\xe0\xa5\x87\xe0\xa4\x82 \xe0\xa4\xa7\xe0\xa4\xbe\xe0\xa4\xb0\xe0\xa4\xbe 144 \xe0\xa4\x95\xe0\xa5\x87 \xe0\xa4\xac\xe0\xa5\x80\xe0\xa4\x9a \xe0\xa4\xb8\xe0\xa5\x8b\xe0\xa4\xb6\xe0\xa4\xb2 \xe0\xa4\xa6\xe0\xa5\x82\xe0\xa4\xb0\xe0\xa5\x80 \xe0\xa4\xac\xe0\xa4\xa8\xe0\xa4\xbe\xe0\xa4\x95\xe0\xa4\xb0 \xe0\xa4\xaa\xe0\xa4\xb0\xe0\xa4\x9a\xe0\xa4\xbe \xe0\xa4\xa6\xe0\xa5\x87\xe0\xa4\xa8\xe0\xa5\x87 \xe0\xa4\x95\xe0\xa5\x80 \xe0\xa4\xa4\xe0\xa5\x88\xe0\xa4\xaf\xe0\xa4\xbe\xe0\xa4\xb0\xe0\xa5\x80 \xe0\xa4\x95\xe0\xa4\xb0\xe0\xa4\xa4\xe0\xa5\x87 \xe0\xa4\x9c\xe0\xa4\xbc\xe0\xa4\xbf\xe0\xa4\xae\xe0\xa5\x8d\xe0\xa4\xae\xe0\xa5\x87\xe0\xa4\xa6\xe0\xa4\xbe\xe0\xa4\xb0 \xe0\xa4\xad\xe0\xa4\xbe\xe0\xa4\xb0\xe0\xa4\xa4\xe0\xa5\x80\xe0\xa4\xaf \xe0\xa4\xb5\xe0\xa5\x80\xe0\xa4\xb0 \xe0\xa4\xac\xe0\xa4\xbe\xe0\xa4\xb2\xe0\xa4\x95\xe0\xa5\xa4 #COVID19 #Rajasthan https://t.co/HzTYWKSrXq',India,"['Mumbai, Mumbai Suburban, Maharashtra', 'The Mumbai, Assembly Street, The Shore, Leith, City of Edinburgh, Scotland', 'Mumbai, High Road, Swaythling, Southampton, South East, England']","[[19.0759899, 72.8773928], [55.9751258, -3.1658656], [50.93845555, -1.3804753361164122]]"
1311134787415859200,1311134787415859200,2020-09-30 02:44:27,http://pbs.twimg.com/media/EjIWE20U0AA8c0z.jpg,https://t.co/BMB6nmwLxK,photo,en,[0],-,IRN,,b'OOA 9:30AM of Sept 30 2020 PSSg Ryan Ramos Team Leader distributed IEC material re-COVID-19 PNP Recruitment Anti-Illegal drugs and Anti-Murder Theft/Robbery/Anti-RAPE during Oplan Sita at Brgy. Sampaga of this municipality. https://t.co/BMB6nmwLxK',"Iran, Islamic Republic of","['برگی, , اشرفی لاله, تبریز, بخش مرکزی شهرستان تبریز, شهرستان تبریز', ""Vadodara 'D' Cabin, SH__, Gorwa, Vadodara, Vadodara Taluka, Vadodara District, Gujarat""]","[[38.0513116, 46.2318393], [22.3464533, 73.1584541]]"
1311134764229963776,1311134764229963776,2020-09-30 02:44:22,http://pbs.twimg.com/media/EjIWHngX0AoxrkY.jpg,https://t.co/7Rp2sn5emn,photo,es,"[[-77.02623158469137, -12.1340463501198], [-77.02623158469137, -12.1340463501198], [-77.02623158469137, -12.1340463501198], [-77.02623158469137, -12.1340463501198]]",Peru,PER,"La Molina, Peru",b'Mi voluntariado para la vacuna #Sinophram \xc2\xa1Vamos Per\xc3\xba! Que ya falta poco para despertar de esta pesadilla...#PonElHombro #Qu\xc3\xa9dateEnCasa #COVID19 https://t.co/7Rp2sn5emn',Peru,-,-
1311134718637871105,1311134718637871105,2020-09-30 02:44:11,http://pbs.twimg.com/media/EjIWDQpWoAUvfXX.jpg,https://t.co/O3JQCVf8iU,photo,es,"[[-99.995232, 16.684013], [-99.476067, 16.684013], [-99.476067, 17.233886], [-99.995232, 17.233886]]",Mexico,MEX,"Acapulco de Juárez, Guerrero",b'Siguiendo la estrategia digital de @Sectur_Acapulco en sinergia con el distintivo Manejo Responsable del Turismo se capacitan virtualmente 10 gu\xc3\xadas de Turistas Generales practicando protocolos de la nueva normalidad: que contribuyen a mitigaci\xc3\xb3n del COVID19.@AcapulcoGob https://t.co/O3JQCVf8iU',Mexico,-,-
1311134501821722631,1311134501821722631,2020-09-30 02:43:19,http://pbs.twimg.com/media/EjIV3h5XYAAjeWy.jpg,https://t.co/nIEG4hEyfA,photo,es,[0],-,BRA,Sistema solar - 3ra roca  ,b'@clarincom Es Ud Pe\xc3\xb1afort comiendo con Boudou en CABA? \xc2\xbfCu\xc3\xa1l es la situaci\xc3\xb3n de Amado? NO se alarmaban por los contagios y denostaban los bares abiertos por ser focos de contagio. Hay algo m\xc3\xa1s letal que el COVID SU doble discurso https://t.co/nIEG4hEyfA',Brazil,"['Solar, Eldorado, Microrregião de Iguatemi, Região Geográfica Intermediária de Dourados, Mato Grosso do Sul, Região Centro-Oeste', 'El Solar, Valle de Mena, Espinosa de los Monteros, Castilla y León', 'El Solar, Formiche Alto, Gúdar-Javalambre, Teruel, Aragón']","[[-23.8156795, -54.1024682], [43.0476458, -3.1543386], [40.3287925, -0.9007133]]"
1311134456745353217,1311134456745353217,2020-09-30 02:43:08,http://pbs.twimg.com/media/EjIV1TWVgAEJGaG.jpg,https://t.co/zTLK83IYWB,photo,in,[0],-,IDN,,b'Patko 4073 Polsek Cilandak Brigadir Nuryono Selasa (29/9/2020) (12.36) Penegakan Prokes Covid-19 di Pasar Mede Cilandak Barat. @dividibumaspolri@humas.pmj@multimedia.humaspolri@polres_metro_jaksel@budisartono96@polisi_infonesia@matapolisi https://t.co/zTLK83IYWB',Indonesia,"['Cilandak, Daerah Khusus Ibukota Jakarta']","[[-6.2868976, 106.7944211]]"
1311134429771952128,1311134429771952128,2020-09-30 02:43:02,http://pbs.twimg.com/media/EjIV0INXsAAJqln.jpg,https://t.co/Bmr8ei7bal,photo,en,[0],-,SGP,Singapore,b'No Singapore Michelin food guide for 2020 due to Covid-19 https://t.co/rgNHIy52wP https://t.co/Bmr8ei7bal',Singapore,"['Singapore, Singapore, Central', 'Singapore, Central', 'Singapore']","[[1.3408630000000001, 103.83039182212079], [1.2904753, 103.8520359], [1.357107, 103.8194992]]"
1311134417537044480,1311134417537044480,2020-09-30 02:42:59,http://pbs.twimg.com/media/EjIVjXZU4AAAhvU.jpg,https://t.co/mCXKRz1nTm,photo,en,[0],-,AUS,"UNSW Sydney, Australia",b'Whats been going on with our alcohol consumption during #COVID19?@AlisonRitter1@claireskis_w + @MichalaKowalski from @DrugPolicy_DPMP present new research on people\xe2\x80\x99s alcohol consumption over the last 6 months: 15 Oct 11am AESThttps://t.co/8AzMso0gg0 @Eventbrite https://t.co/mCXKRz1nTm',Australia,"['University of New South Wales Kensington Campus, Gate 2, UNSW, Kensington, Sydney, New South Wales']","[[-33.91758275, 151.23124024652654]]"
1311134365997441024,1311134365997441024,2020-09-30 02:42:47,http://pbs.twimg.com/media/EjIVuZSUwAAAmwB.jpg,https://t.co/KReWFuC9DN,photo,en,[0],-,IND,"Hyderabad, India",b'@aajtak @ABPNews Dear sir in so many places A good brother hood and peace exists among communities. A example of this is a neighbor died due to Corona  while His relatives ran away and left body without  performing  last rites.Muslims  performed  last rites. https://t.co/KReWFuC9DN',India,"['Hyderabad, Telangana']","[[17.38878595, 78.46106473453146]]"
1311134313132380162,1311134313132380162,2020-09-30 02:42:34,http://pbs.twimg.com/media/EjIVqHWUwAAMphC.jpg,https://t.co/jR6kaQ1b2E,photo,in,[0],-,IDN,,b'Personil Polsek Teluk Mengkudu melaksanakan kegiatan Operasi Yustisi terkait peningkatan disiplin dan penegakan hukum protokol kesehatan di wilayah Kec. Teluk Mengkudu dalam rangka pencegahan penyebaran Covid-19. Selasa (29/09/2020) pukul 09.00 Wib s/d selesai. https://t.co/jR6kaQ1b2E',Indonesia,"['Gereja Penyebaran Injil, Jalan Jendral Ahmad Yani, Majalengka, Majalengka, Jawa Barat', 'Gereja Penyebaran Injil, Arie Lasut, Batu Kota, Kleak, Manado, Sulawesi Utara', 'Gereja Penyebaran Injil, Jalan R.A. Kartini, Sekolaq Muliaq, Kalimantan Timur', 'Pekan Selesai, Langkat', 'KEDAI BELUM SELESAI, Jalan Permukiman Antar Gampong, Manggeng, Aceh Barat Daya', 'RUMAH KOSONG - BELUM SELESAI, Jalan T.R. Iskandar, Manggeng, Aceh Barat Daya']","[[-6.8359629, 108.22996698634707], [1.5029726, 124.86684452401269], [-0.24567765, 115.78492680745708], [3.5680527, 98.4218163], [3.6226262, 96.90048325000001], [3.61917425, 96.93906295690786]]"
1311134181670285313,1311134181670285313,2020-09-30 02:42:03,http://pbs.twimg.com/media/EjIVliFVoAAo3e_.jpg,https://t.co/cLvLYWFnsz,photo,en,[0],-,KOR,City of San Fernando,b'@AustinLASchools meets with PTSA parents at Northridge MS and visit our COVID Testing Center.  @ClevelandcosL @LAUSDNorthwest #CovidTesting https://t.co/cLvLYWFnsz',"Korea, Republic of","['대한민국', 'South Australia', 'Salerno, Campania', 'San Fernando, Bahía de Cádiz, Cádiz, Andalucía', 'Fernando, Ponte de Sor, Tramaga e Vale de Açor, Portalegre, Alto Alentejo, Alentejo', 'Fernando, Municipio de Allen, Departamento General Roca', 'El Fernando, Toreno, El Bierzo, Ponferrada, Castilla y León']","[[36.638392, 127.6961188], [-30.5343665, 135.6301212], [40.419441649999996, 15.310756230322482], [36.4643934, -6.198203], [39.2798722, -7.8828983], [-38.9883762, -67.82173188966593], [42.6494087, -6.5015727]]"
1311134144080932864,1311134144080932864,2020-09-30 02:41:54,http://pbs.twimg.com/media/EjIVjkOUYAIjuLw.jpg,https://t.co/IAJwJ4VLFv,photo,en,[0],-,IND,"Gurgaon, India",b'ESIC Issues Guidelines for COVID-19 Safety Measures at Workplace - https://t.co/7ggRzJzUxF https://t.co/IAJwJ4VLFv',India,"['Gurgaon, Haryana']","[[28.42826235, 77.00270014657752]]"
1311134140096557070,1311134140096557070,2020-09-30 02:41:53,http://pbs.twimg.com/media/EjIVi7WXgAEFxTi.jpg,https://t.co/umR8ichhWs,photo,pt,[0],-,RUS,"São Luís, Brasil",b'Hoje confesso que chorei um bocado ouvindo o secret\xc3\xa1rio @carloselula falando da \xc3\xa1rdua batalha travada contra o Coronav\xc3\xadrus e so reconhecimento da import\xc3\xa2ncia dos profissionais da sa\xc3\xbade. Uma das cenas mais bonitas dos \xc3\xbaltimos dias. Ele sem d\xc3\xbavidas entrou pra hist\xc3\xb3ria. https://t.co/umR8ichhWs',Russian Federation,"['Северный административный округ, Москва, Центральный федеральный округ', 'Sao, Koutiala, Cercle de Koutiala, Sikasso', 'Sao, Buldhana, Buldana, Maharashtra', 'São Luís, Microrregião da Aglomeração Urbana de São Luís, Região Geográfica Intermediária de São Luís, Maranhão, Região Nordeste', 'Leibniz Universität IT Services, Schloßwender Straße, Mitte, Mitte, Hannover, Region Hannover, Niedersachsen', 'Luis, North Merville Park I Subdivision, Obando, Obando', 'Luis, El Salto, Recoleta, Recoleta, Provincia de Santiago, Región Metropolitana de Santiago']","[[55.833657349999996, 37.52580863361071], [11.9450024, -5.4132279], [20.5112858, 76.2129253], [-2.5634605, -44.2448718], [52.3796463, 9.723506701999998], [14.6880805, 120.9563937], [-33.3921525, -70.6419153]]"
1311134137479294977,1311134137479294977,2020-09-30 02:41:52,http://pbs.twimg.com/media/EjIVjLTXcAICR6a.jpg,https://t.co/xczoQt6gHW,photo,es,[0],-,COL,Colombia,b'\xf0\x9f\x87\xba\xf0\x9f\x87\xb8  EN VIVO - #Debate2020Biden (@JoeBiden) sobre la transparencia en las elecciones: Hay millones de personas que no votar\xc3\xa1n por correo por el Covid-19 y quienes lo hagan presencialmente lo har\xc3\xa1n de una forma segura. \xc2\xa1Voten voten voten!.https://t.co/uezCM4qGws https://t.co/xczoQt6gHW',Colombia,"['Colombia', 'Colombia, Huila', 'Colombia, Calle de Colombia, Hispanoamérica, Madrid, Área metropolitana de Madrid y Corredor del Henares, Comunidad de Madrid, Comunidad de Madrid']","[[2.8894434, -73.783892], [3.4271286, -74.700208390882], [40.4571156, -3.6769611]]"
1311134026296709120,1311134026296709120,2020-09-30 02:41:26,http://pbs.twimg.com/media/EjIVcpEWsAEfBID.jpg,https://t.co/JzRyOwOQ7G,photo,es,[0],-,ARG,Argentina,b'Covid-19: La Argentina pas\xc3\xb3 a M\xc3\xa9xico y es el octavo pa\xc3\xads con m\xc3\xa1s casos https://t.co/I4Xs9jgktJ https://t.co/JzRyOwOQ7G',Argentina,"['Argentina', 'La Argentina, Huila', 'La Argentina, Marsella, Risaralda']","[[-34.9964963, -64.9672817], [2.1860618499999998, -76.01276506104725], [4.92335675, -75.78583616581926]]"
1311133965974032384,1311133965974032384,2020-09-30 02:41:11,http://pbs.twimg.com/media/EjIVY-MUYAEwEHI.jpg,https://t.co/hBIoSzgf9a,photo,en,[0],-,GBR,Aberdeen/Kuala Lumpur,b'I will be in Layar Sarawak until Friday next week for fieldwork. Layar is currently COVID-19 free and has been for weeks. Another five schools to visit to get feedback from teachers on challenges in conducting online teaching amid national lockdowns. https://t.co/hBIoSzgf9a',United Kingdom,"['Aberdeen City, Scotland', 'Aberdeen, Grays Harbor County, Washington', 'Aberdeen, Brown County, South Dakota', 'Kuala, Maui County, Hawaii', 'Kuala, Bireuen', 'Kuala, Singkawang, Kalimantan Barat', 'Kuala Lumpur', 'Lumpur, Gresik, Gresik, Jawa Timur']","[[57.1482429, -2.0928095], [46.975371, -123.815722], [45.4649805, -98.487813], [21.1350826, -156.730543], [5.2335087, 96.72018980698466], [0.9128732, 108.9591156], [3.1516964, 101.6942371], [-7.1510268, 112.6449129]]"
1311133946370023426,1311133946370023426,2020-09-30 02:41:07,http://pbs.twimg.com/media/EjIVYEcWAAEg70r.jpg,https://t.co/XNezZ9tsEV,photo,es,[0],-,CHN,Ciudad de México,b'Alemania limita reuniones familiares y fiestas para contener rebrote de covid-19 https://t.co/0Ppw4QiChB https://t.co/XNezZ9tsEV',China,"['巢湖市 (Chaohu), 安徽省', 'La Ciudad, Pueblo Nuevo, Durango', 'Ciudad de México']","[[31.627503, 117.8842395], [23.7321711, -105.6899702], [19.4326296, -99.1331785]]"
1311133917416546310,1311133917416546310,2020-09-30 02:41:00,http://pbs.twimg.com/media/EjH50AlXsAAUsQs.jpg,https://t.co/zr8v4jjcTh,photo,es,[0],-,ECU,"Cuenca, Ecuador",b'Casos de covid-19 se incrementan en clubes que compiten en la Libertadores. El cuadro de Sangolqu\xc3\xad debe enfrentar este mi\xc3\xa9rcoles 30 de septiembre al cuadro de Flamengo club que registra la mayor cantidad de afectados. https://t.co/FqTof7H3qP \xe2\x86\x92 El Tel\xc3\xa9grafo https://t.co/zr8v4jjcTh',Ecuador,"['Cuenca, Luis Cordero, El Sagrario, Cuenca, Cuenca, Azuay']","[[-2.8970399, -79.0039477]]"
1311133862618173441,1311133862618173441,2020-09-30 02:40:47,http://pbs.twimg.com/tweet_video_thumb/EjIVSr9WsAAkAyQ.jpg,https://t.co/QAuxLpfwno,photo,en,[0],-,CAN,"Toronto, Ontario",b'@Samantha_Moul I would be there in a second (+12 hours) if there wasn\xe2\x80\x99t a virus and the border wasn\xe2\x80\x99t closed but FaceTime me in for back up or support whenever you need https://t.co/QAuxLpfwno',Canada,"['Toronto, Golden Horseshoe, Ontario']","[[43.6534817, -79.3839347]]"
1311133837032747008,1311133837032747008,2020-09-30 02:40:41,http://pbs.twimg.com/media/EjIVRhCU8AApded.jpg,https://t.co/rNosxpsTPn,photo,es,[0],-,ARG,Córdoba,b'La morra del coral blanco seguro que quiso advertirnos del covid y no le entendimos\xf0\x9f\x98\x94 https://t.co/rNosxpsTPn',Argentina,"['Córdoba, Municipio de Córdoba, Pedanía Capital, Departamento Capital, Córdoba', 'Córdoba', 'Córdoba, Córdoba, Andalucía']","[[-31.4173391, -64.183319], [-32.0967361, -63.7940923], [37.8845813, -4.7760138]]"
1311133691964424192,1311133691964424192,2020-09-30 02:40:06,http://pbs.twimg.com/media/EjIVJPAXsAILvKt.jpg,https://t.co/7cWl7msbbn,photo,en,[0],-,VEN,"Montalbán, Venezuela",b'Did you know? On November 3rd electors all across the U.S. are expected to go to voting centers wearing face masks using hand sanitizers and observing social distancing https://t.co/KMPOfCr0fC #USElections2020 #CDC https://t.co/7cWl7msbbn',"Venezuela, Bolivarian Republic of","['Montalbán, Parroquia Montalbán, Municipio Montalbán, Carabobo']","[[10.2117994, -68.3248544]]"
1311133680480538625,1311133680480538625,2020-09-30 02:40:03,http://pbs.twimg.com/media/EjIVGMEWkAAROmi.jpg,https://t.co/k5r86rHoOK,photo,es,[0],-,MEX,México,b'\xc2\xa1Los Yankees apalearon al ganador de la Triple Corona! \xf0\x9f\x98\x8eLos Bombarderos del Bronx se llevaron el primero de la serie tras derrotar a los Indians comandados por Shane Bieber. #MLBxESPN \xe2\x9a\xbehttps://t.co/iVyWt1XpUZ https://t.co/k5r86rHoOK',Mexico,"['Ciudad de México', 'México', 'Mexico, Audrain County, Missouri']","[[19.4326296, -99.1331785], [22.5000485, -100.0000375], [39.1697626, -91.8829484]]"
