id,id_str,created_at,media_url,url,type,language_code,bounding_box,country,country_code,user_loc,full_text,country_or_territory,CIME_geolocation_string,CIME_coordinates
1311149821734973443,1311149821734973443,2020-09-30 03:44:12,http://pbs.twimg.com/media/EjIj0G6VgAYIw99.jpg,https://t.co/lzlAAPD1u9,photo,in,[0],-,NLD,Amsterdam (Alur MaSuk TERDAlaM,b'Yonif Raider 300/Bjw Laksanakan Donor Plasma Darah Guna Mendukung Penyembuhan Pasien Covid-19 Di Indonesia https://t.co/slYq7rLRCJ https://t.co/lzlAAPD1u9',Netherlands,"['Amsterdam, Amsterdam, Noord-Holland, Nederland', 'Amsterdam, Noord-Holland, Nederland', 'Île de la Nouvelle-Amsterdam, Îles Saint-Paul et Nouvelle-Amsterdam, Terres australes et antarctiques françaises', 'Alur, Andhra Pradesh', 'Aluru, Aluru taluk, Hassan district, Karnataka', 'Alur, Umarga, Osmanabad, Maharashtra']","[[52.3727598, 4.8936041], [52.3727598, 4.8936041], [-37.8364908, 77.5541729591024], [15.42859565, 77.26133358526621], [12.9788319, 75.9935776], [17.6971696, 76.4252463]]"
1311149771709530112,1311149771709530112,2020-09-30 03:44:00,http://pbs.twimg.com/media/EjIhxddXsAATiEA.jpg,https://t.co/VJYJfmxI2I,photo,es,[0],-,MEX,México,b'#Morelos es el estado con mayor letalidad por #coronavirus en todo M\xc3\xa9xicohttps://t.co/x5c8LcCNT6 https://t.co/VJYJfmxI2I',Mexico,"['Ciudad de México', 'México', 'Mexico, Audrain County, Missouri']","[[19.4326296, -99.1331785], [22.5000485, -100.0000375], [39.1697626, -91.8829484]]"
1311149457472450560,1311149457472450560,2020-09-30 03:42:45,http://pbs.twimg.com/media/EjIjDkKWkAMyw8Y.jpg,https://t.co/yQrlBJ6pMf,photo,en,[0],-,USA,"Marietta, Georgia",b'The Alpha Omega Campus Ministry hosted their first in-person Sunday worship service since the beginning of the Covid-19 pandemic! \xe2\x98\x80\xef\xb8\x8f Between two services ~120 college students were able to worship God outdoors! What a joy it is to be together again!#northrivercoc https://t.co/yQrlBJ6pMf',United States,"['Georgia', 'საქართველო', 'Georgia, Franklin County, Vermont']","[[32.3293809, -83.1137366], [41.6809707, 44.0287382], [44.72422295, -73.14704151731551]]"
1311149414077968386,1311149414077968386,2020-09-30 03:42:34,http://pbs.twimg.com/media/EjIjcW1VkAEkR72.jpg,https://t.co/T5B00Z4Y5l,photo,en,[0],-,PHL,"Manila City, National Capital ",b'We hope that youre September was great!As we enter October we remind everyone to observe preventive measures against COVID-19.Always wear your face masks &amp face shields practice social distancing &amp wash hands frequently. \xf0\x9f\x91\x8d#housemaidsph #maidagency #COVID19 #GCQ https://t.co/T5B00Z4Y5l',Philippines,"['Manila, First District']","[[14.5907332, 120.9809674]]"
1311149408701030404,1311149408701030404,2020-09-30 03:42:33,http://pbs.twimg.com/media/EjIjcEpUYAAlhFH.jpg,https://t.co/Z1m2erHDX8,photo,in,[0],-,USA,Kuala Lumpur,b'Pejabat MP Lembah Pantai tutup seorang kakitangan positif Covid https://t.co/2YZ2viZz4P https://t.co/Z1m2erHDX8',United States,"['Kuala, Maui County, Hawaii', 'Kuala, Bireuen', 'Kuala, Singkawang, Kalimantan Barat', 'Kuala Lumpur', 'Lumpur, Gresik, Gresik, Jawa Timur']","[[21.1350826, -156.730543], [5.2335087, 96.72018980698466], [0.9128732, 108.9591156], [3.1516964, 101.6942371], [-7.1510268, 112.6449129]]"
1311149407178354690,1311149407178354690,2020-09-30 03:42:33,http://pbs.twimg.com/media/EjIjcApU8AArjYk.jpg,https://t.co/A23jz9ftXW,photo,es,[0],-,COL,"Bogotá, Colombia",b'Am\xc3\xa9rica: baja importante para el juego de Copa por posible covid-19 https://t.co/9VcmTZaP0F https://t.co/A23jz9ftXW',Colombia,['Bogotá'],"[[4.6533326, -74.083652]]"
1311149405853024261,1311149405853024261,2020-09-30 03:42:32,http://pbs.twimg.com/media/EjIjZyNUwAIohYV.jpg,https://t.co/HldKSvNxCD,photo,en,[0],-,IND,"Muzaffarnagar, India",b'Mask distribution in block jansath.#COVID19India #WearAMask #COVID19 #Corona https://t.co/HldKSvNxCD',India,"['Muzaffarnagar, Uttar Pradesh']","[[29.44800635, 77.74068502568672]]"
1311149378384654337,1311149378384654337,2020-09-30 03:42:26,http://pbs.twimg.com/media/EjIjaT_WkAIgPet.jpg,https://t.co/dg9BUvQKcl,photo,en,[0],-,GBR,Harrow Wealdstone NW LONDON,b'ON AIR: Dead Weight by Leo Gandelman / We Entertain. Empower. Educate . Talk to us on 0208 090 2121 HELLO@FANTASTICRADIO.CO.UK https://t.co/D9IgF9xxVN #HOMEOFPOSSIBILITIES #BELIEVEYOURPOSSIBILITIES https://t.co/bE4hgti6fx  Buy song https://t.co/dvcVe3BEkx https://t.co/dg9BUvQKcl',United Kingdom,"['Wealdstone, London Borough of Harrow, Greater London, England']","[[51.5936353, -0.3294758]]"
1311149211887587329,1311149211887587329,2020-09-30 03:41:46,http://pbs.twimg.com/media/EjIhF3jX0AAj8fQ.jpg,https://t.co/Wj8136b9uT,photo,es,[0],-,ARG,#Argentina,b'\xf0\x9f\x93\xb7 Hijos de Trump olvidan las reglas del debate y se quitan los barbijos violando el protocolo \xf0\x9f\x98\xb7 AFP/Olivier Douliery #Debate2020 #EricTrump #IvankaTrump De tal palo tal astilla https://t.co/fKltBlqcX4 \xf0\x9f\x91\x8e #Debates2020 #Covid_19 https://t.co/Wj8136b9uT',Argentina,"['Argentina', 'La Argentina, Huila', 'La Argentina, Marsella, Risaralda', 'La Argentina Argentina, Yolombó, Nordeste, Antioquia']","[[-34.9964963, -64.9672817], [2.1860618499999998, -76.01276506104725], [4.92335675, -75.78583616581926], [6.6363715, -74.7620697]]"
1311149202584592384,1311149202584592384,2020-09-30 03:41:44,http://pbs.twimg.com/media/EjIjPwKXgAAOM1W.jpg,https://t.co/MCuomfPHtR,photo,es,[0],-,VEN,"Monagas, Venezuela",b'\xf0\x9f\x93\x8cMantener el distanciamiento social y colectivo nos ayuda a cortar la cadena de trasmisi\xc3\xb3n del COVID-19. \xf0\x9f\x91\x8f\xf0\x9f\xa7\xbc\xf0\x9f\x92\xa6\xf0\x9f\x98\xb7#CICPC@DouglasRicoVzla@CICPCPREVENCION@Cicpc374@cicpc128@finojosal@sifontesjose324https://t.co/k0i8edDo0g https://t.co/MCuomfPHtR',"Venezuela, Bolivarian Republic of","['Monagas, Región Nororiental']","[[9.333333, -63.0]]"
1311149194032414722,1311149194032414722,2020-09-30 03:41:42,http://pbs.twimg.com/media/EjIjPU3XcAU9J9C.jpg,https://t.co/hdoTpWn90u,photo,es,[0],-,CUB,Cuba,b'Explicaci\xc3\xb3n oportuna y precisa en @mesaredondacuba sobre la educaci\xc3\xb3n superior en tiempos de Covid ofrecida por el Ministro de @CubaMES @jsaborido50 y los rectores de UH y de @AlmaCujae. https://t.co/hdoTpWn90u',Cuba,"['Cuba', 'La Cuba, Maestrazgo, Teruel, Aragón', 'Juba, Central Equatoria']","[[23.0131338, -80.8328748], [40.5916447, -0.2981642], [4.8472017, 31.5951655]]"
1311149161040039941,1311149161040039941,2020-09-30 03:41:34,http://pbs.twimg.com/media/EjIgvacWAAAanv_.jpg,https://t.co/gj88dsdpKK,photo,es,[0],-,GTM,Guatemala,b'Seis privados de libertad dieron positivo al #Covid19 \xe2\x9e\xa1\xef\xb8\x8f https://t.co/Ews5Y9r2QA https://t.co/gj88dsdpKK',Guatemala,"['Guatemala', 'Guatemala', 'Ciudad de Guatemala, Guatemala']","[[14.64247, -90.5131351], [15.6356088, -89.8988087], [14.6222328, -90.5185188]]"
1311149106526662657,1311149106526662657,2020-09-30 03:41:21,http://pbs.twimg.com/media/EjIjKbAX0AAK2ne.jpg,https://t.co/fvhmIZLOWi,photo,en,[0],-,CAN,Canada,b'She\xe2\x80\x99s the fourth person\xe2\x80\x99s hair I\xe2\x80\x99ve done during covid I\xe2\x80\x99m on a roll https://t.co/fvhmIZLOWi',Canada,"['Canada', ""Cañada, l'Alt Vinalopó / El Alto Vinalopó, Alacant / Alicante, Comunitat Valenciana"", 'Canada, Pike County, Kentucky']","[[61.0666922, -107.9917071], [38.6750263, -0.8097021], [37.6056575, -82.3243095]]"
1311149055708282880,1311149055708282880,2020-09-30 03:41:09,http://pbs.twimg.com/media/EjIjC3vU8AAV_fc.jpg,https://t.co/uqUUY7UQuv,photo,ne,[0],-,IND,New Delhi,b'\xe0\xa4\xa6\xe0\xa4\xbf\xe0\xa4\xb2\xe0\xa5\x8d\xe0\xa4\xb2\xe0\xa5\x80 NCR \xe0\xa4\x95\xe0\xa5\x8b \xe0\xa4\x87\xe0\xa4\xa8\xe0\xa5\x8d\xe0\xa4\xa6\xe0\xa4\xbf\xe0\xa4\xb0\xe0\xa4\xbe\xe0\xa4\xaa\xe0\xa5\x81\xe0\xa4\xb0\xe0\xa4\xae - \xe0\xa4\x9c\xe0\xa5\x8d\xe0\xa4\xb5\xe0\xa5\x87\xe0\xa4\xb2\xe0\xa4\xb0\xe0\xa5\x80 \xe0\xa4\xaa\xe0\xa4\xb8\xe0\xa4\xb2\xe0\xa4\xae\xe0\xa4\xbe COVID \xe0\xa4\xab\xe0\xa4\xb0\xe0\xa5\x8d\xe0\xa4\xae\xe0\xa5\x8d\xe0\xa4\xaf\xe0\xa4\xbe\xe0\xa4\xb2\xe0\xa4\xbf\xe0\xa4\x9f\xe0\xa4\xbf\xe0\xa4\x9c \xe0\xa4\xaa\xe0\xa5\x81\xe0\xa4\xb0\xe0\xa4\xbe \xe0\xa4\x97\xe0\xa4\xb0\xe0\xa5\x87\xe0\xa4\xb0 \xe0\xa4\xae\xe0\xa4\xbe\xe0\xa4\xa4\xe0\xa5\x8d\xe0\xa4\xb0 \xe0\xa4\xac\xe0\xa4\xa8\xe0\xa5\x8d\xe0\xa4\xa6\xe0\xa5\x81\xe0\xa4\x95 \xe0\xa4\xa8\xe0\xa4\xbf\xe0\xa4\x95\xe0\xa4\xbe\xe0\xa4\xb2\xe0\xa5\x87 \xe0\xa4\xa1\xe0\xa4\x95\xe0\xa5\x88\xe0\xa4\xa4 \xe0\xa4\xb9\xe0\xa4\xb0\xe0\xa5\x82\xe0\xa4\xb2\xe0\xa5\x87\xe0\xa4\xb9\xe0\xa4\xbe\xe0\xa4\x87\xe0\xa4\x9f \xe0\xa4\x85\xe0\xa4\xab \xe0\xa4\xaa\xe0\xa5\x8d\xe0\xa4\xb0\xe0\xa5\x8b\xe0\xa4\xab\xe0\xa5\x87\xe0\xa4\xb6\xe0\xa4\xa8\xe0\xa4\xb2\xe0\xa4\xbf\xe0\xa4\x9c\xe0\xa5\x8d\xe0\xa4\xae....\xf0\x9f\x98\x9c\xf0\x9f\x98\x9c\xf0\x9f\xa4\xa3\xf0\x9f\xa4\xa3 https://t.co/uqUUY7UQuv',India,"['New Delhi, Delhi']","[[28.6138954, 77.2090057]]"
1311149053091000321,1311149053091000321,2020-09-30 03:41:08,http://pbs.twimg.com/media/EjIjHYNU4AA0GnG.jpg,https://t.co/kewiu1oZwT,photo,es,[0],-,COL,"Cartagena, Colombia",b'Letalidad por Coronavirus en Cartagena durante septiembre es de 2.4% https://t.co/ej1XKdEnFl https://t.co/kewiu1oZwT',Colombia,"['Cartagena de Indias, Dique']","[[10.4195841, -75.5271224]]"
1311148950250872832,1311148950250872832,2020-09-30 03:40:44,http://pbs.twimg.com/media/EjIjBMxUMAAKy90.jpg,https://t.co/YSEgOlUbP1,photo,in,[0],-,IDN,Jakarta,b'DPRD DKI Gelar Paripurna Raperda Penanggulangan Covid-19 https://t.co/ojOnxNj0YW https://t.co/YSEgOlUbP1',Indonesia,"['Daerah Khusus Ibukota Jakarta', 'Jakarta, Rosalina Village III, Nalom, Toril, Davao City, Davao Region', 'Jakarta, East Gate, Taytay, Rizal, Calabarzon']","[[-6.1753942, 106.827183], [7.0387157, 125.5063617], [14.5484874, 121.1332162]]"
1311148932500602881,1311148932500602881,2020-09-30 03:40:40,http://pbs.twimg.com/media/EjIi9AEVoAAf4CU.jpg,https://t.co/4pPwbrCzqk,photo,in,[0],-,IND,,b'Tim Patroli Koramil 1410-03/Tompobulu laksanakan penegakan disiplin protokol kesehatan PDPK covid-19 Edukasi di Pasar Sentral dan Terminal Kab. Bantaeng. Rabu 30/9/20. https://t.co/4pPwbrCzqk',India,"['Padmapukur, Kona Expressway, Santragachi, Howrah, Howrah, West Bengal', 'Pasar, Kluet Selatan, Aceh Selatan', 'El Pasar, Castillejo de Mesleón, Riaza, Castilla y León', 'Pasar, Adwani, Narendra Nagar, Tehri Garhwal, Uttarakhand']","[[22.5682566, 88.3057431], [3.0395911, 97.3962467], [41.2938537, -3.6099264], [30.204506, 78.3999181]]"
1311148903329193986,1311148903329193986,2020-09-30 03:40:33,http://pbs.twimg.com/media/EjIi-qOU0AEc8A4.jpg,https://t.co/T0wuYVDiBY,photo,ro,[0],-,ROU,Romania,b'China ordon\xc4\x83 firmelor locale s\xc4\x83 evite importurile de alimente congelate din \xc8\x9b\xc4\x83ri cu focare majore de coronavirus https://t.co/mYHHhqnJ4z #news #stiri #romania https://t.co/T0wuYVDiBY',Romania,"['România', 'Romania, Lastra a Signa, Firenze, Toscana', 'Romania, Summit Township, Somerset County, Pennsylvania']","[[45.9852129, 24.6859225], [43.7740786, 11.1289816], [39.7934153, -79.0447485]]"
1311148903077609473,1311148903077609473,2020-09-30 03:40:33,http://pbs.twimg.com/media/EjIi-qOUwAE2G5h.jpg,https://t.co/EqYR1M3h0i,photo,es,[0],-,CHL,,b'Pok\xc3\xa9mon Espada y Escudo: Las nieves de la corona se estrenar\xc3\xa1 el 23 de octubre https://t.co/wP4GHvUDZu https://t.co/EqYR1M3h0i',Chile,"['El Escudo, Lautaro, Provincia de Cautín, Región de la Araucanía', 'Octubre, Los Mochis, Ahome, Sinaloa']","[[-38.5670833, -72.0840146], [25.7758683, -108.9803249]]"
1311148889739866112,1311148889739866112,2020-09-30 03:40:29,http://pbs.twimg.com/media/EjIi95_WkAIXCYw.jpg,https://t.co/Op4Z6mJlg8,photo,pt,[0],-,BRA,"Rio de Janeiro, Brazil",b'Check-up completo: como o Flamengo se preparou para escalar o grupo que teve Covid - (https://t.co/gl2vDMSJnP) #Flamengo #FlaTT https://t.co/Op4Z6mJlg8',Brazil,"['Rio de Janeiro, Região Geográfica Imediata do Rio de Janeiro, Região Metropolitana do Rio de Janeiro, Região Geográfica Intermediária do Rio de Janeiro, Rio de Janeiro, Região Sudeste']","[[-22.9110137, -43.2093727]]"
1311148790133354497,1311148790133354497,2020-09-30 03:40:06,http://pbs.twimg.com/media/EjIi4F-VgAEMka8.jpg,https://t.co/3VXJf21VVL,photo,en,[0],-,CAN,"Brampton, Ontario",b'Canada reports 1657 new coronavirus cases 13 new deaths on Tuesday https://t.co/87J2JFst5y https://t.co/3VXJf21VVL',Canada,"['Brampton, Peel Region, Golden Horseshoe, Ontario']","[[43.6858146, -79.7599337]]"
1311148783351209991,1311148783351209991,2020-09-30 03:40:04,http://pbs.twimg.com/media/EjIi3s-U8AIGiXF.jpg,https://t.co/l3yhK4yFWr,photo,es,[0],-,BOL,,b'S\xc3\xb3lo detr\xc3\xa1s del Minsal: Contralor\xc3\xada revela que Carabineros y Gendarmer\xc3\xada lideran gasto covid https://t.co/FokqhRdl2W https://t.co/l3yhK4yFWr',"Bolivia, Plurinational State of","['Ministerio de Salud, Calle Cañada Strongest, Cotahuma, La Paz, Pedro Domingo Murillo, La Paz', 'ガスト 一関店, 一関大東線, 五代町, 一関市, 岩手県']","[[-16.5042566, -68.1316105], [38.93836495, 141.13462940946891]]"
1311148774996226048,1311148774996226048,2020-09-30 03:40:02,http://pbs.twimg.com/media/EjIi3OHXcAA4stS.jpg,https://t.co/x23uuzxmrQ,photo,es,[0],-,BRA,Buenos Aires Argentina,b'Coronavirus Argentina: 13.477 nuevos casos confirmados https://t.co/ICjdCZLRAH https://t.co/x23uuzxmrQ',Brazil,"['Buenos, Boituva, Boituva, Região Imediata de Sorocaba, Região Metropolitana de Sorocaba, Região Geográfica Intermediária de Sorocaba, São Paulo, Região Sudeste', 'Buenos, Garza County, Texas', 'Buenos, Tarpon Point, Sarasota County, Florida', 'Buenos Aires, Comuna 6', 'Argentina, Brisamar, Buenos Aires, Lázaro Cárdenas, Lázaro Cárdenas, Michoacán de Ocampo', 'Aires, Viù, Unione Montana Alpi Graie, Provincia di Torino, Piemonte', 'Aires, São João da Ponta, São João da Ponta, Microrregião de Salgado, Região Geográfica Intermediária de Castanhal, Pará, Região Norte', 'Aires, Alūksnes novads, Vidzeme', 'Aires, Sarmiento, Centro, Centro de Integración Territorial Centro, Posadas, Departamento Capital, Misiones', 'Argentina', 'La Argentina, Huila', 'La Argentina, Marsella, Risaralda']","[[-23.2622438, -47.720747], [33.2992595, -101.4876461], [27.035693, -82.270483], [-34.6075682, -58.4370894], [18.0128201, -102.2787215], [45.232178, 7.3864886], [-0.8801767, -47.9324683], [57.3643447, 27.5564899], [-27.3647372, -55.8966635], [-34.9964963, -64.9672817], [2.1860618499999998, -76.01276506104725], [4.92335675, -75.78583616581926]]"
1311148765131288578,1311148765131288578,2020-09-30 03:40:00,http://pbs.twimg.com/media/EjHfit4X0AMQLbm.jpg,https://t.co/xFBqlAreiX,photo,es,[0],-,CHL,"Santiago, Chile",b'Los cierres tras el regreso a clases en Europa. La segunda ola ha mostrado sus primeras consecuencias a causa del virus: 19 escuelas cerradas en Francia 49 en Alemania y 75 en Italia https://t.co/JAEQIrLtwO https://t.co/xFBqlAreiX',Chile,"['Santiago, Provincia de Santiago, Región Metropolitana de Santiago']","[[-33.4377968, -70.6504451]]"
1311148658193084417,1311148658193084417,2020-09-30 03:39:34,http://pbs.twimg.com/media/EjIiwUJU4AAj2Xm.jpg,https://t.co/wl3s9RpZay,photo,es,[0],-,FRA,"Las Vegas, NV",b'Gracias a @walgreens por su apoyo en las jornadas gratuitas de vacunaci\xc3\xb3n del flu! #flushot https://t.co/wl3s9RpZay',France,"['Laas, Mirande, Gers, Occitanie, France métropolitaine', 'McCarran International Airport, Wayne Newton Boulevard, Midtown UNLV, Paradise, Clark County, Nevada', 'Las, gmina Ślemień, powiat żywiecki, województwo śląskie', 'Las Vegas, Clark County, Nevada', 'Vegas, Nueva Paz, Mayabeque', 'Vegas, Holladay, Salt Lake County, Utah', 'Vegas, Tinajo, Las Palmas, Canarias']","[[43.4697786, 0.3098676], [36.0861034, -115.16111989849915], [49.7392544, 19.4295064], [36.1672559, -115.1485163], [22.790658, -81.8189192], [40.6782805, -111.832156], [29.0763888, -13.6809496]]"
1311148653998874625,1311148653998874625,2020-09-30 03:39:33,http://pbs.twimg.com/media/EjIiwDTVoAAows3.jpg,https://t.co/zjgK4B1I0e,photo,in,[0],-,TZA,,b'saengil cakue hamida pganesh!!!! semangat terus kuliah sm aiseknya lov yu lots Tuhan berkati kak igi selalu yeaaa semoga kita bs ketemuuu stlh corona\xf0\x9f\x98\xa4\xf0\x9f\x92\xa8\xf0\x9f\x92\x98 @wonpilisme https://t.co/zjgK4B1I0e',"Tanzania, United Republic of","['Hamida, Becco Street, Miembeni, Vingunguti, Dar es Salaam, Coastal Zone', '60, Jalan Datuk Di Banta, Lingkungan Tato, BTN Gindi Permai, Kota Bima, Kabupaten Bima, Nusa Tenggara Barat', 'H̱âmîda, Yoboki يوبوكي, Dikhil دخيل']","[[-6.8551167, 39.201742], [-8.448051750000001, 118.73997575], [11.737773, 41.90581]]"
1311148604082597892,1311148604082597892,2020-09-30 03:39:21,http://pbs.twimg.com/media/EjIitJ9XgAY0VZQ.jpg,https://t.co/fVmkEvTrcN,photo,en,[0],-,FRA,,b'Govt said school authorities should not demand second term fees! Due to #COVID19 schools were closed so no fees shld be paid.. https://t.co/fVmkEvTrcN',France,"['centre médical COVID19, Quai Jean de Béthencourt, Centre Ville Rive Gauche, Rouen, Rouen, Seine-Maritime, Normandie, France métropolitaine', 'Triaje inicial de Urgencias provisional (CoViD19), Calle Real de Burgos, Puente Jardín, La Victoria, Valladolid, Valladolid, Castilla y León', 'Triaje inicial de Urgencias provisional (CoViD19), Calle de la Dulzaina, Las Viudas-Aramburu, Las Delicias, Valladolid, Valladolid, Castilla y León']","[[49.4404016, 1.0754066], [41.6561774, -4.7177394], [41.6303043, -4.712253320328967]]"
1311148435639164929,1311148435639164929,2020-09-30 03:38:41,http://pbs.twimg.com/media/EjIijVVWAAYKpSi.jpg,https://t.co/ytzFdAClYP,photo,hi,[0],-,IND,"Raipur, India",b'@RahulGandhi Ye haal hai sir CHHATTISGARH me INC ka social distancing ka.iske upar kya kehne hai aap ke @RahulGandhi ji. yaha to kuch boliye aise bheed laga ke fir corona kya dhong kyu krti hai congress. @narendramodi @PMOIndia @BJP4India @INCIndia @BJP4CGState @IYCChhattisgarh @drramansingh https://t.co/ytzFdAClYP',India,"['Raipur, Raipur Tahsil, Raipur, Chhattisgarh']","[[21.2379469, 81.6336833]]"
1311148303103324160,1311148303103324160,2020-09-30 03:38:10,http://pbs.twimg.com/media/EjIiaTTVoAIWfnV.jpg,https://t.co/XWJwuE1UL8,photo,en,[0],-,USA,"Bellevue, WA, USA #unity2020",b'@JoeBiden seriously said tonight if we had just listened and worked with #Xitler couldve avoided this entire #CCPVirus #coronavirus pandemic \xf0\x9f\x98\xb3 https://t.co/XWJwuE1UL8',United States,"['Bellevue, King County, Washington']","[[47.6144219, -122.1923372]]"
1311148287425040384,1311148287425040384,2020-09-30 03:38:06,http://pbs.twimg.com/media/EjIiZ8OU0AAlz9L.jpg,https://t.co/OoqwIoVmcA,photo,in,[0],-,IDN,"Purbalingga, Indonesia",b'Polsek Padamara bersama gugus tugas percepatan penanggulangan Covid 19 Kec. Padamara (TNIPOLRIDINKESPemkec Padamara dan Pemdes Sokawera)melaksanakan Operasi Yustisi Protokol Covid 19 (Razia Patuh Masker) di depan Balai Desa Sokawera8 orang yang tidak menggunakan masker. https://t.co/OoqwIoVmcA',Indonesia,"['Purbalingga, Jawa Tengah']","[[-7.32733005, 109.39989874266684]]"
1311148237957537792,1311148237957537792,2020-09-30 03:37:54,http://pbs.twimg.com/media/EjIiX7nXcAAk0oC.jpg,https://t.co/pVPojHKcz6,photo,it,[0],-,ITA,"Campania, Italia",b'La #ParoleDaDifendere sono tante oggi per\xc3\xb2 considerato il tempo in cui viviamo mi sento di difendere la parola mascherina perch\xc3\xa9 se \xc3\xa8 vero che il nemico \xc3\xa8 il virus \xc3\xa8 vero anche che la mascherina salva la vita#CasaLettori @CasaLettori #Buongiorno a tutti https://t.co/pVPojHKcz6',Italy,['Campania'],"[[40.860672, 14.843984]]"
1311148208211423233,1311148208211423233,2020-09-30 03:37:47,http://pbs.twimg.com/media/EjIiT9-U4AAtSJl.jpg,https://t.co/onINmgJyD9,photo,in,[0],-,IDN,"Kartosuro, Indonesia",b'Anggota koramil 06 Kts  melaks kegiatan patroli bersama dgn Polsek Kartasura dalam rangka kamtibmas dan himbauan kpd Pegawai dan pengunjung Toserba Laris agar selalu memakai masker mencuci tangan dan menghindari kerumunan guna memutus penyebaran virus covid - 19 di wil kec.Kts. https://t.co/onINmgJyD9',Indonesia,"['Mitra Kartosuro, Kartasura, Sukoharjo, Jawa Tengah']","[[-7.5512783500000005, 110.7383394155876]]"
1311148112984014850,1311148112984014850,2020-09-30 03:37:24,http://pbs.twimg.com/media/EjIiNW9X0AA4qp2.jpg,https://t.co/My15eJLuon,photo,en,[0],-,BWA,Botswana,b'Happy 54 years of Independence Batswana\xf0\x9f\x87\xa7\xf0\x9f\x87\xbcThe management and staff at Protea hotel by Marriott Gaborone Masa Square would like to send warm wishes to Batswana and wish you a truly memorable day. Remember to adhere to all safety precautions set to fight the Covid19 pandemic. PULA! https://t.co/My15eJLuon',Botswana,"['Botswana', 'بوتسوانا, دبي, دبي', 'Botswana, Chihuahua, Municipio de Chihuahua, Chihuahua']","[[-23.1681782, 24.5928742], [25.21469935, 55.18134118967216], [28.6753942, -106.0360469]]"
1311148061939232768,1311148061939232768,2020-09-30 03:37:12,http://pbs.twimg.com/media/EjIh_uPU4AAcaz2.jpg,https://t.co/uucrGLLcHa,photo,in,[0],-,IDN,"Jakarta, Indonesia",b'Deputi Bid. Sistem Informasi Kepegawaian Suharmen cek jalanny SKB #CPNS2019 susulan bg 12 peserta yg pd jadwal awal dinyatakan positif Covid-19 sehingga hrs ikuti SKB dg jadwal terpisah. SKB dilaksanakan di kantor BKN Pusat dg protokol kesehatan yg sangat ketat Rabu (30/9/2020). https://t.co/uucrGLLcHa',Indonesia,['Daerah Khusus Ibukota Jakarta'],"[[-6.1753942, 106.827183]]"
1311148015743164416,1311148015743164416,2020-09-30 03:37:01,http://pbs.twimg.com/media/EjIiH_TU8AEDAgK.jpg,https://t.co/nwR0oFhZJB,photo,en,[0],-,IND,"Jaipur, India",b'#Debates2020   Biden targets Trump on COVID-19 response President defends himself calling it Chinas fault#PresidentialDebate2020 #debates #debate #Trump #JoeBiden https://t.co/nwR0oFhZJB',India,"['Jaipur, Jaipur Tehsil, Jaipur, Rajasthan']","[[26.916194, 75.820349]]"
1311148015734972416,1311148015734972416,2020-09-30 03:37:01,http://pbs.twimg.com/media/EjIiKlTXYAA8gju.jpg,https://t.co/84g7QtfBTc,photo,en,[0],-,ESP,,b'CCTV+@CCTV_Plus53000 Spanish flags were placed at Roma Park to honor #Spains #coronavirus deaths during the pandemic on September 27 in Madrid Spain. (Photo via Reuters and VCG) https://t.co/84g7QtfBTc',Spain,"['Madrid, Área metropolitana de Madrid y Corredor del Henares, Comunidad de Madrid, Comunidad de Madrid']","[[40.4167047, -3.7035825]]"
1311147948797960192,1311147948797960192,2020-09-30 03:36:45,http://pbs.twimg.com/media/EjIh8s-UcAUbv5k.jpg,https://t.co/bT2sEVfwUY,photo,en,[0],-,PHL,,b'Adams MPS pers conducted dialogue  to the populace in Adams Ilocos Norte regarding preventive measures against  COVID 19 such as: always observe social distancing proper wearing of face mask ELCAC illegal drugs and always vigilant at all times. https://t.co/bT2sEVfwUY',Philippines,"['Adams, Laoag, Ilocos Norte, Ilocos', 'Ilocos']","[[18.4613108, 120.903571], [17.200655750000003, 120.47000660619342]]"
1311147815956078592,1311147815956078592,2020-09-30 03:36:13,http://pbs.twimg.com/media/EjIh-juUYAAZVoh.jpg,https://t.co/BaRF6DttQY,photo,in,[0],-,IDN,,b'Kegiatan Personil Polsek melaksanakan Patroli Blue Light guna antisipasi terjadinya 3C dan melakukan Operasi Yustisi terhadap kepatuhan warga dalam antisipasi pencegahan percepatan penyebaran Virus Corona Covid 19 diwilkum Polsek Kuala yang dipimpin oleh Kasihumas Ardiansyah https://t.co/BaRF6DttQY',Indonesia,"['Jalan Patroli, Bah Kapul, Siantar Sitalasari, Kota Pematang Siantar', 'Jalan Patroli, Teluk, Purwokerto, Banyumas, Jawa Tengah', 'Markas Unit Patroli, Jalan Marunda Pulo, RT 02, RW 07, Daerah Khusus Ibukota Jakarta', 'Blumenau, Região Geográfica Imediata de Blumenau, Região Geográfica Intermediária de Blumenau, Santa Catarina, Região Sul', 'Blue, Coos County, Oregon', 'The Blue Market, Market Place, South Bermondsey, Bermondsey, London, Greater London, England', 'Gereja Penyebaran Injil, Jalan Jendral Ahmad Yani, Majalengka, Majalengka, Jawa Barat', 'Gereja Penyebaran Injil, Arie Lasut, Batu Kota, Kleak, Manado, Sulawesi Utara', 'Gereja Penyebaran Injil, Jalan R.A. Kartini, Sekolaq Muliaq, Kalimantan Timur']","[[2.9538624, 99.0419594], [-7.4562492, 109.2463718], [-6.09841155, 106.95687920475496], [-26.9195567, -49.0658025], [43.2710293, -124.0864865], [51.492572949999996, -0.06370034335156559], [-6.8359629, 108.22996698634707], [1.5029726, 124.86684452401269], [-0.24567765, 115.78492680745708]]"
1311147796007981056,1311147796007981056,2020-09-30 03:36:09,http://pbs.twimg.com/media/EjIh-IvXcAA37bi.jpg,https://t.co/c1UjQzdsSn,photo,es,[0],-,IDN,,b'\xf0\x9f\x87\xb0\xf0\x9f\x87\xbc  #30Sep  El Pr\xc3\xadncipe de la Corona Sheikh Nawaf al-Ahmad al-Sabah ser\xc3\xa1 el nuevo Emir de Kuwait: candidato continuo. Habr\xc3\xa1 40 d\xc3\xadas de luto y las banderas ser\xc3\xa1n izadas a media asta. https://t.co/c1UjQzdsSn',Indonesia,"['Jalan Wijaya Kusuma XA1, Samarinda, Kalimantan Timur', 'Nuevo, Corso Alto Avenue, Lakeview Hot Springs, Lakeview, Riverside County, California']","[[-0.4872199, 117.1303701], [33.8056345, -117.13956015339622]]"
1311147743616708610,1311147743616708610,2020-09-30 03:35:56,http://pbs.twimg.com/media/EjIhshfU0AExZs4.jpg,https://t.co/XyS5SLHkAi,photo,en,[0],-,CHN,"Beijing, CHINA",b'53000 Spanish flags were placed at Roma Park to honor #Spains #coronavirus deaths during the pandemic on September 27 in Madrid Spain. (Photo via Reuters and VCG) https://t.co/XyS5SLHkAi',China,"['北京市, 北京市']","[[39.906217, 116.3912757]]"
1311147521016619008,1311147521016619008,2020-09-30 03:35:03,http://pbs.twimg.com/media/EjIhuNKVoAEtsyU.jpg,https://t.co/2J9tSA611m,photo,fr,[0],-,CHE,"Neuchâtel, Switzerland",b'Canton de Neuch\xc3\xa2tel: plus de 200 manifestations priv\xc3\xa9es annonc\xc3\xa9es https://t.co/9j2TpanbGv https://t.co/2J9tSA611m',Switzerland,"['Neuchâtel, District de Neuchâtel, Neuchâtel']","[[46.9895828, 6.9292641]]"
