id,id_str,created_at,media_url,url,type,language_code,bounding_box,country,country_code,user_loc,full_text,country_or_territory,CIME_geolocation_string,CIME_coordinates
1311141961718476811,1311141961718476811,2020-09-30 03:12:58,http://pbs.twimg.com/media/EjIcqN2X0AMaqO1.jpg,https://t.co/syZvxDfBCW,photo,es,[0],-,COL,Colombia,b'#covid_19 Debido a la pandemia se realizan trabajos de desinfecci\xc3\xb3n en todos los medios de transporte p\xc3\xbablico en este caso se realiz\xc3\xb3 el acompa\xc3\xb1amiento en la limpieza de taxis. Se mantiene la alerta y es necesario no bajar la guardia https://t.co/syZvxDfBCW',Colombia,"['Colombia', 'Colombia, Huila', 'Colombia, Calle de Colombia, Hispanoamérica, Madrid, Área metropolitana de Madrid y Corredor del Henares, Comunidad de Madrid, Comunidad de Madrid']","[[2.8894434, -73.783892], [3.4271286, -74.700208390882], [40.4571156, -3.6769611]]"
1311141881816911872,1311141881816911872,2020-09-30 03:12:39,http://pbs.twimg.com/media/EjIcfK0U0AE-pTJ.jpg,https://t.co/znkhGEuQJ3,photo,es,[0],-,MEX,"Piedras Negras, Mexico",b'Aumentan contagios de coronavirus en menores de EU tras reapertura de escuelas  https://t.co/ognFmL0Fe2 https://t.co/znkhGEuQJ3',Mexico,"['Ciudad de México', 'México', 'Mexico, Audrain County, Missouri']","[[19.4326296, -99.1331785], [22.5000485, -100.0000375], [39.1697626, -91.8829484]]"
1311141572054978562,1311141572054978562,2020-09-30 03:11:25,http://pbs.twimg.com/media/EjIcMd4UMAAWVOl.jpg,https://t.co/ccyWJIgAKJ,photo,en,[0],-,USA,Kuala Lumpur,b'#globalbuzz Four out of 10 Seoul residents believe their mental health has deteriorated due to the coronavirus outbreak - Yonhap News Agency https://t.co/ccyWJIgAKJ',United States,"['Kuala, Maui County, Hawaii', 'Kuala, Bireuen', 'Kuala, Singkawang, Kalimantan Barat', 'Kuala Lumpur', 'Lumpur, Gresik, Gresik, Jawa Timur']","[[21.1350826, -156.730543], [5.2335087, 96.72018980698466], [0.9128732, 108.9591156], [3.1516964, 101.6942371], [-7.1510268, 112.6449129]]"
1311141553289613313,1311141553289613313,2020-09-30 03:11:20,http://pbs.twimg.com/media/EjIcS01WkAEBTtY.jpg,https://t.co/GQAY9sFZLz,photo,es,[0],-,MEX,"Sonora, México",b'Los cuidados contra el Covid-19 y los accidentes automovil\xc3\xadsticos han incrementado en Sonora principalmente en los puntos tur\xc3\xadsticos en las \xc3\xbaltimas semanas asegur\xc3\xb3 @Enrique_Clausen titular de la SSA.@ssaludsonora https://t.co/GQAY9sFZLz',Mexico,['Sonora'],"[[29.3333331, -110.6666671]]"
1311141489909493760,1311141489909493760,2020-09-30 03:11:05,http://pbs.twimg.com/media/EjIcOMoVgAUcCyX.jpg,https://t.co/GLAP2yZ4cS,photo,en,[0],-,USA,"Oakland, CA",b'Cleansing after the debates with the apparently most prescient film ever made Escape from LA--the President who wins by demonizing a West Coast City then assumes life time Presidency. Complete with Corona face shields and US Police Force badges https://t.co/GLAP2yZ4cS',United States,"['Oakland, Alameda County, California', 'Oakland County, Michigan', 'Oakland, Pottawattamie County, Iowa']","[[37.8044557, -122.2713563], [42.6618842, -83.3804439], [41.3091596, -95.3966671]]"
1311141467625320460,1311141467625320460,2020-09-30 03:11:00,http://pbs.twimg.com/media/EjIcLLWXgAICHZ_.jpg,https://t.co/zC6kc05CLa,photo,es,[0],-,MEX,"México, Querétaro",b'#Quer\xc3\xa9taro duplicar\xc3\xada pruebas de #Covid19 de ser necesario: gobernador. Asegur\xc3\xb3 que se realizar\xc3\xa1n todos los esfuerzos para mantener la estrategia de reactivaci\xc3\xb3n econ\xc3\xb3mica.https://t.co/w9Lj12pf16 https://t.co/zC6kc05CLa',Mexico,"['Ciudad de México', 'México', 'Mexico, Audrain County, Missouri', 'México-Queretaro, Tepotzotlán, Tepotzotlán, Estado de México', 'Querétaro', 'Santiago de Querétaro, Municipio de Querétaro, Querétaro', 'Queretaro, Yécora, Sonora']","[[19.4326296, -99.1331785], [22.5000485, -100.0000375], [39.1697626, -91.8829484], [19.7104107, -99.2066987], [20.8542575, -99.84756], [20.5954708, -100.3970593], [28.5416667, -108.9406667]]"
1311141464727052288,1311141464727052288,2020-09-30 03:10:59,http://pbs.twimg.com/media/EjIcNroXYAEK7Pi.jpg,https://t.co/6WXOKivYi0,photo,en,[0],-,USA,"Mount Clemens, MI",b'Soccer football teams deal with coronavirus-related schedule changes https://t.co/9X1MgmjIqi https://t.co/6WXOKivYi0',United States,"['Montana', 'Mato Grosso, Região Centro-Oeste', 'Matera, Basilicata', 'Mount Clemens, Macomb County, Michigan', 'Clemens, Churchill County, Nevada', 'Clemens, Saskatchewan', 'Clémens, Artassenx, Mont-de-Marsan, Landes, Nouvelle-Aquitaine, France métropolitaine']","[[47.3752671, -109.6387579], [-12.2115009, -55.5716547], [40.447641899999994, 16.47357384028852], [42.5972563, -82.8779754], [39.9691403, -118.2190128], [52.779374, -104.5817282], [43.8583017, -0.3901164]]"
1311141360045559810,1311141360045559810,2020-09-30 03:10:34,http://pbs.twimg.com/media/EjIcHXeWkAENu8i.jpg,https://t.co/l1Sau5iqZ5,photo,en,[0],-,USA,USA,b'COVID tracking apps in Europe failhttps://t.co/6ld82ofynt https://t.co/l1Sau5iqZ5',United States,"['United States', '宇佐市, 大分県', 'Уж, Народицька селищна громада, Народицький район, Житомирська область']","[[39.7837304, -100.4458825], [33.532005, 131.3496745], [51.2229505, 29.2074938]]"
1311141261747736576,1311141261747736576,2020-09-30 03:10:11,http://pbs.twimg.com/media/EjIcBrgVoAAuAUg.jpg,https://t.co/0VEptsQFN0,photo,in,[0],-,IDN,Jakarta,b'Trump: Penanganan Covid-19 Akan Lebih Buruk di Bawah Biden https://t.co/NOGx7bd9Px https://t.co/0VEptsQFN0',Indonesia,"['Daerah Khusus Ibukota Jakarta', 'Jakarta, Rosalina Village III, Nalom, Toril, Davao City, Davao Region', 'Jakarta, East Gate, Taytay, Rizal, Calabarzon']","[[-6.1753942, 106.827183], [7.0387157, 125.5063617], [14.5484874, 121.1332162]]"
1311141236846157825,1311141236846157825,2020-09-30 03:10:05,http://pbs.twimg.com/media/EjIcAYCVgAE7V0u.jpg,https://t.co/SKLE57sHZN,photo,es,[0],-,CHL,Santiago - Chile,b'Regi\xc3\xb3n de Ays\xc3\xa9n alcanz\xc3\xb3 hoy 300 casos activos de Covid-19 https://t.co/P81JrpsTQq https://t.co/SKLE57sHZN',Chile,"['Santiago, Provincia de Santiago, Región Metropolitana de Santiago']","[[-33.4377968, -70.6504451]]"
1311141232182087681,1311141232182087681,2020-09-30 03:10:04,http://pbs.twimg.com/media/EjIcAKHVgAE_1E0.jpg,https://t.co/lai52YNiXt,photo,es,[0],-,CHL,Santiago - Chile,b'Pelarco: Detectan caso de Covid-19 en liceo que reanudar\xc3\xa1 sus clases el lunes https://t.co/V2ez3oqPZp https://t.co/lai52YNiXt',Chile,"['Santiago, Provincia de Santiago, Región Metropolitana de Santiago']","[[-33.4377968, -70.6504451]]"
1311141155736899586,1311141155736899586,2020-09-30 03:09:46,http://pbs.twimg.com/media/EjIb7TVXYAEKz6C.jpg,https://t.co/R2wxMfcVWW,photo,en,[0],-,IND,Bangalore,b'US Presidential Debate with full heat \xf0\x9f\x94\xa5 from name calling COVID Handling blaming India &amp China Tax Evasion of Trump Biden\xe2\x80\x99s Academic performance!  #Debate2020 #debates #Trump2020 #BidenHarris2020 #debate https://t.co/R2wxMfcVWW',India,"['Bengaluru, Bangalore North, Bangalore Urban, Karnataka', 'Bangalore, Parque Industrial Logisik II, Valle de San Francisco, Laguna de San Vicente, Villa de Reyes, San Luis Potosí', '28, Thorney Hill, Thorneywood, Sneinton, City of Nottingham, East Midlands, England']","[[12.9791198, 77.5912997], [21.9803453, -100.8589639], [52.96511615, -1.12280635]]"
1311141140926787586,1311141140926787586,2020-09-30 03:09:42,http://pbs.twimg.com/media/EjIb55nXgAIHU-n.jpg,https://t.co/eL3MakgPgO,photo,es,[0],-,PRI,,b'\xf0\x9f\x93\x8c#Hoy operativo descacharrado Barrio Alta Rioja \xf0\x9f\x9a\xa7Seguimos trabajando y aplicando medidas preventivas p/evitar la problematica del dengueEliminaci\xc3\xb3n de posibles criaderos del mosquito Aedes Aegypti transmisor del virus del #Dengue@ines_byd @GFGalvan @municipalidadlr@JosePuy2 https://t.co/eL3MakgPgO',Puerto Rico,"['Mosquito, Vieques, Puerto Rico', 'Ades, Chailey, Lewes, East Sussex, South East, England']","[[18.1287822, -65.51081680110698], [50.956025999999994, -0.0073818582807960754]]"
1311140959615410176,1311140959615410176,2020-09-30 03:08:59,http://pbs.twimg.com/media/EjIbsOIX0AIg7oy.jpg,https://t.co/QUZRKC5AV0,photo,es,[0],-,ESP,,b'#Ej\xc3\xa9rcitoGT a trav\xc3\xa9s de la Primera Brigada de Infanter\xc3\xada disemin\xc3\xb3 mensaje sobre las medidas de prevenci\xc3\xb3n ante el #COVID19 a trav\xc3\xa9s de meg\xc3\xa1fonos en el municipio de Santa Ana #Pet\xc3\xa9n.#365D\xc3\xadasAlServicioDeMiPatria https://t.co/QUZRKC5AV0',Spain,"['Trav., Torrecilla de los Ángeles, Torrecilla de los Ángeles, Sierra de Gata, Cáceres, Extremadura', 'Municipio, Piazza San Paolo, Casale, Dogliani, Cuneo, Piemonte', 'Peterhouse (University of Cambridge), Trumpington Street, Newnham, Cambridge, Cambridgeshire, East of England, England']","[[40.2479383, -6.4175989], [44.5300662, 7.9451014], [52.19974405000001, 0.11896276986772013]]"
1311140852413194244,1311140852413194244,2020-09-30 03:08:33,http://pbs.twimg.com/media/EjIbqDHU4Acqxtf.jpg,https://t.co/VowVBCYCkt,photo,es,[0],-,MEX,"Ecatepec de Morelos, México",b'C\xc3\xb3mo que emvipi no ha dado punto? No que era la reina sin corona??#SomosTitanes https://t.co/VowVBCYCkt',Mexico,"['Ecatepec, Sor Juana Inés de la Cruz, Florida, Arboledas de Aragón, Ecatepec de Morelos, Estado de México']","[[19.5151265, -99.0360506]]"
1311140735488385024,1311140735488385024,2020-09-30 03:08:05,http://pbs.twimg.com/media/EjIbjHQU4AE_mVd.jpg,https://t.co/Iq8cUFTAYS,photo,in,[0],-,IDN,,b'Pers. Polsek Cilandak pimpinan Ipda Pahri bersama Tiga Pilar Selasa (29/9/2020) (14.01) Ops Yustisi PSBB Aman Nusa II Penegakan Prokes Covid-19 di Pertokoan Jl. RS. Fatmawati Cilandak. @dividibumaspolri@humas.pmj@multimedia.humaspolri@polres_metro_jaksel@budisartono96 https://t.co/Iq8cUFTAYS',Indonesia,"['Sepakat Bersama, Banjarmasin, Kalimantan Selatan', 'Tega, Buzău', 'Nusa, Cagayancillo, Palawan, Mimaropa']","[[-3.2035515, 114.5199683], [45.2761494, 26.3770304], [9.6539526, 121.2347102]]"
1311140734150549507,1311140734150549507,2020-09-30 03:08:05,http://pbs.twimg.com/media/EjIbi_NXgAEvjaX.jpg,https://t.co/sGj5KxsVfh,photo,en,[0],-,USA,"Minnesota, USA",b'Tale of two debates: Nobles County debate got most heated about how to build a library doing better outreach and child care. Presidential debate was most heated on refusing to condemn white supremacy excusing the deaths from COVID and refusing to accept election results #2020 https://t.co/sGj5KxsVfh',United States,['Minnesota'],"[[45.9896587, -94.6113288]]"
1311140697538400257,1311140697538400257,2020-09-30 03:07:56,http://pbs.twimg.com/media/EjIbeAfVgAYwXad.jpg,https://t.co/ZpNoDGvRmD,photo,en,[0],-,IND,"Mumbai, India",b'Biden later called Trump a clown a racist &amp Putins puppy &amp told Trump: Youre the worst president America has ever had.Moderator #ChrisWallace never established control.#Trump #Biden #PresidentialDebate2020 #Election2020 #COVID19 #pandemic #economy #electionintegrity https://t.co/ZpNoDGvRmD',India,"['Mumbai, Mumbai Suburban, Maharashtra']","[[19.0759899, 72.8773928]]"
1311140692320645120,1311140692320645120,2020-09-30 03:07:55,http://pbs.twimg.com/media/EjIa-I6U0AIE1Aa.jpg,https://t.co/o3sX3Ow0zi,photo,en,[0],-,IND,"Mumbai, India",b'Will you shut up man? This is so unpresidential said an exasperated #Biden Biden after Trumps repeated interruptions.#Trump for his part said: Theres nothing smart about you Joe.#Debatenight #PresidentialDebate2020 #Election2020 #COVID19 #pandemic #economy #integrity https://t.co/o3sX3Ow0zi',India,"['Mumbai, Mumbai Suburban, Maharashtra']","[[19.0759899, 72.8773928]]"
1311140660339027969,1311140660339027969,2020-09-30 03:07:47,http://pbs.twimg.com/media/EjIbeUUU8AAMXy_.jpg,https://t.co/lqmI3YoqXp,photo,in,[0],-,IDN,,b'Babinsa Koramil 11/Pwk KandisSerma G Munthe Bersama 1 Orang Anggota Melaksanakan Patroli &amp Sosialisasi di tempat2 keramaian Untuk menghimbau dan mengajak masyarakat agar mematuhi   Protokol kesehatan dalam upaya  pencegahan Covid 19 di Kec. Kandis Kab. Siak.(30/09/2020) https://t.co/lqmI3YoqXp',Indonesia,"['Jalan Keramaian, Banjarmasin, Kalimantan Selatan']","[[-3.3150295, 114.5924472]]"
1311140657323409412,1311140657323409412,2020-09-30 03:07:47,http://pbs.twimg.com/media/EjIbeGSVgAM7OtX.jpg,https://t.co/LRI8H6akgK,photo,in,[0],-,CYP,,b'Wakapolsek Bayan Iptu Abdul Aziz bersama 11 (sebelas) Anggota yang tergabung dalam Forkompimcam Bayan melaksanakan himbauan dan pendisiplinan kepada warga serta Ops Yustisi penegakan hukum Protokol Kesehatan guna mencegah Pandemi Covid-19 di Wil. Kab. Purworejo. Rabu 30/09/2020. https://t.co/LRI8H6akgK',Cyprus,"['Covid-19 Pandemi Hastanesi, Göçmenköy, Lefkoşa, Λευκωσία - Lefkoşa, Κύπρος', 'Corona-Pandemie 2020, B 15, Thomasberg, Püchersreuth, Neustadt an der Waldnaab (VGem), Landkreis Neustadt an der Waldnaab, Bayern']","[[35.206596149999996, 33.334179083814604], [49.7738507, 12.2002949]]"
1311140653120643073,1311140653120643073,2020-09-30 03:07:46,http://pbs.twimg.com/media/EjIbdaXVoAApD1X.jpg,https://t.co/7ZiEzu6WAO,photo,in,[0],-,IDN,"Garut, Indonesia",b'Bersama Lawan COVID-19 Dengan Mematuhi PROTOKOL KESEHATAN 3M MEMAKAI MASKER  MenJaga JARAK Dan Mencuci Tangan#lawancovid19 #adaptasikebiasanbaru #jagajarak #pakemasker #jangantertular #jangannularin #cucitangan https://t.co/7ZiEzu6WAO',Indonesia,"['Garut, Tasikmalaya, Jawa Barat']","[[-7.2162543, 107.9014912]]"
1311140610057940993,1311140610057940993,2020-09-30 03:07:35,http://pbs.twimg.com/media/EjIbb8WWkAAfnhS.jpg,https://t.co/DrfUFYgr74,photo,en,[0],-,USA,Michigan,b'Tonights #PresidentialDebate reminds me of a modern day Walter Matthau and Jack Lemmon. #grumpyoldmen #Debate2020 #2020debate #debate #debates #Trump2020 #BidenHarris2020 #shutupman #Election2020 #COVID19 https://t.co/DrfUFYgr74',United States,"['Michigan', 'Michigan, Chittenden, Rutland County, Vermont', 'ميشيغان, دبي, دبي']","[[43.6211955, -84.6824346], [43.7895101, -72.8848295], [25.2126277, 55.14808203434125]]"
1311140604743573505,1311140604743573505,2020-09-30 03:07:34,http://pbs.twimg.com/media/EjIbboaUcAAQrrG.jpg,https://t.co/0Gtwk74OYD,photo,en,[0],-,MYS,Malaysia,b'Second Covid-19 screening test for Pahang exco negative https://t.co/SvaXXbN49x https://t.co/0Gtwk74OYD',Malaysia,"['Malaysia', 'ماليزيا, دبي, دبي', 'Malaysia, San Antonio Valley 10 and 11, Parañaque, Fourth District']","[[4.5693754, 102.2656823], [25.2330853, 55.18324970603023], [14.4778989, 121.0327206]]"
1311140515845492737,1311140515845492737,2020-09-30 03:07:13,http://pbs.twimg.com/media/EjIbWZQXYAYkjWj.jpg,https://t.co/r1GzciAzrX,photo,fr,[0],-,FRA,Paris,b'Covid-19 : \xc3\xa0 Bobigny depuis le d\xc3\xa9but de la crise sanitaire les inscriptions au Secours populaire explosent https://t.co/xysLlB83Yy https://t.co/r1GzciAzrX',France,"['Paris, Paris, Paris, Île-de-France, France métropolitaine', 'Paris, Île-de-France, France métropolitaine', 'Paris, Lamar County, Texas']","[[48.8566969, 2.3514616], [48.8588897, 2.320041027461107], [33.6617962, -95.555513]]"
1311140489869971456,1311140489869971456,2020-09-30 03:07:07,http://pbs.twimg.com/media/EjIbUmmUMAAcCi-.jpg,https://t.co/Ag03ksZOoN,photo,in,[0],-,IDN,,b'kegiatan Polsek Perbaungan terkait Operasi Yustisi dalam rangka peningkatan disiplin dan penegakan hukum Protokol Kesehatan pencegahan penyebaran Virus Covid-19 Corona di Jalan Besar Medan Tebing Tinggi Depan Mapolsek Perbaungan desa kota Galuh   Kec.Perbaungan. https://t.co/Ag03ksZOoN',Indonesia,"['Besar, Kota Medan', 'Perbaungan, Serdang Bedagai', 'Kota Galuh, Perbaungan, Serdang Bedagai']","[[3.7036543, 98.7038435], [3.5664929, 98.9571864], [3.5702188, 98.9664983]]"
1311140411939774465,1311140411939774465,2020-09-30 03:06:48,http://pbs.twimg.com/media/EjIbQY4XgAAQdUS.jpg,https://t.co/gepYV84TWT,photo,es,[0],-,MEX,"Sonora, México",b'En Sonora se confirman 10 defunciones por Covid-19 y 121 nuevos pacientes inform\xc3\xb3 Natali Lagarda neuropsic\xc3\xb3loga de la Secretar\xc3\xada de @ssaludsonora https://t.co/gepYV84TWT',Mexico,['Sonora'],"[[29.3333331, -110.6666671]]"
1311140336341667840,1311140336341667840,2020-09-30 03:06:30,http://pbs.twimg.com/media/EjIbLJIUYAECsCw.jpg,https://t.co/XIKlssBUFq,photo,en,"[[88.094457, 22.269493], [88.610027, 22.269493], [88.610027, 22.955918], [88.094457, 22.955918]]",India,IND,"Kolkata, India",b'Covid-19 Sprade through SBSTC @WBSBSTC @WBPolice @MamataOfficial @CMOfficeWB @COVIDNewsByMIB @News18Bengali @abpanandatv https://t.co/XIKlssBUFq',India,-,-
1311140305916362756,1311140305916362756,2020-09-30 03:06:23,http://pbs.twimg.com/media/EjIbJ-jWAAEOZaQ.jpg,https://t.co/z8QERuwVrh,photo,es,[0],-,ECU,"Quito, Ecuador",b'Sin el s\xc3\xa1ndwich y los $20 la banda delincuencial de \xe2\x80\x9cMameluco\xe2\x80\x9d no tiene convocatoria en #Ecuador s\xc3\xb3lo un poco de pendejos aguantando lluvia y buscando #Covid19 mientras sus \xe2\x80\x9cl\xc3\xadderes\xe2\x80\x9d disfrutan lo robado en M\xc3\xa9xico o Europa \xf0\x9f\x90\x80 https://t.co/z8QERuwVrh',Ecuador,"['Quito, Quito, Pichincha']","[[-0.2201641, -78.5123274]]"
1311140222214664192,1311140222214664192,2020-09-30 03:06:03,http://pbs.twimg.com/media/EjIbFYDU0AocLcH.jpg,https://t.co/0SjIiBr84c,photo,en,[0],-,HUN,Hungaria Jamaica Magnolia Sewe,b'https://t.co/DNlYholBnU \xe2\x80\x98He panicked\xe2\x80\x99: Biden blames Trump for 200000 US coronavirus deaths in explosive presidential debate: Democratic presidential nominee Joe Biden blasted Donald Trump for his response to the coronavirus pandemic saying he \xe2\x80\x9cpanicked\xe2\x80\x9d and has never provided\xe2\x80\xa6 https://t.co/0SjIiBr84c',Hungary,"['Magyarország', 'Hungaria, Santa María Chilchotla, Oaxaca', 'Aleea Carpați, Târgu Mureș, Zona Metropolitană Târgu Mureș, Mureș', 'Magnólia kert, II. kerület, Budapest, Közép-Magyarország, Közép-Magyarország', 'Jamaica, Spanish Town, Saint Catherine, Middlesex County', 'Jamaica', 'Jamaica, Queens, Orange, New York', 'Magnolia Close, Chevely, Manchester, Middlesex County', 'Magnolia, Montgomery County, Texas', 'Magnolia, Harrison County, Iowa', 'Magnolia, Columbia County, Arkansas']","[[47.1817585, 19.5060937], [18.3444633, -96.6750853], [46.5538638, 24.5585753], [47.5154336, 19.0350004], [18.1152958, -77.1598454610168], [18.1850507, -77.3947693], [40.6914852, -73.8056771], [18.0321061, -77.5259366], [30.2093794, -95.7507815], [41.6958226, -95.8766762], [33.2670725, -93.2393341]]"
1311140149024096256,1311140149024096256,2020-09-30 03:05:45,http://pbs.twimg.com/media/EjIa7UyU8AA3IS5.jpg,https://t.co/ikKQDh6M0i,photo,en,[0],-,IND,"Lucknow, India",b'My Zee News colleague in Lucknow  Vishal is back on the field after a bout of covid .He was hospitalised took time to get better and is back doing what he does best .people on the field are facing immense challenges in this pandemic and their efforts need more understanding https://t.co/ikKQDh6M0i',India,"['Lucknow, Sadar, Lucknow, Uttar Pradesh']","[[26.8381, 80.9346001]]"
1311140125963763714,1311140125963763714,2020-09-30 03:05:40,http://pbs.twimg.com/media/EjIa-tOVoAArZDp.jpg,https://t.co/e9ahH7bQtO,photo,in,[0],-,IDN,,b'Babinsa Koramil 01/Bengkalis Serka Yanuswar Melaksanakan Aturan Penerapan Pendisiplinan Protokol Kesehatan Kepada Masyarakat di Pasar Terubuk agar pengunjung dan pembeli selalu memakai Masker Cuci Tangan guna pencegahan Covid 19 di Kec. Bengkalis Kab. Bengkalis.(30/09/2020) https://t.co/e9ahH7bQtO',Indonesia,"['Pasar, Kluet Selatan, Aceh Selatan', 'El Pasar, Castillejo de Mesleón, Riaza, Castilla y León', 'Pasar, Adwani, Narendra Nagar, Tehri Garhwal, Uttarakhand']","[[3.0395911, 97.3962467], [41.2938537, -3.6099264], [30.204506, 78.3999181]]"
1311140094804398080,1311140094804398080,2020-09-30 03:05:33,http://pbs.twimg.com/media/EjIa9NdXkAEZyQW.jpg,https://t.co/hejmJD04cE,photo,es,[0],-,MEX,"Tehuacán, Puebla",b'Se exhorta a la ciudadan\xc3\xada a no bajar la guardia y acatar las medidas de prevenci\xc3\xb3n ante esta contingencia por COVID-19.Contin\xc3\xbaa la campa\xc3\xb1a de donaci\xc3\xb3n de cubrebocas guardar la sana distancia y un constante lavado de manos.#QuedateEnCasa#Salud#GobiernoMunicipalTehuac\xc3\xa1n https://t.co/hejmJD04cE',Mexico,"['Tehuacán, Puebla']","[[18.465801149999997, -97.39783479972402]]"
1311140074654846981,1311140074654846981,2020-09-30 03:05:28,http://pbs.twimg.com/media/EjIa8vJU8AA5DKR.jpg,https://t.co/QWrixZkmzr,photo,in,[0],-,IDN,,b'Personel Polsek Batumandi laksanakan pendisiplinan kepada warga agar patuhi protokol kesehatan covid-19#PolriSukseskan3M #PakaiMaskerUntukSemua https://t.co/QWrixZkmzr',Indonesia,"['Kesehatan, Karang Baru, Aceh Tamiang', ""Kesehatan, Dusun Pa'garangan, Desa Laiyolo, Kecamatan Bontosikuyu, Sulawesi Selatan""]","[[4.3192534, 98.0759561], [-6.297022, 120.477654]]"
1311139966345502732,1311139966345502732,2020-09-30 03:05:02,http://pbs.twimg.com/media/EjIa2byWsAMNxO7.jpg,https://t.co/SyIwehQVKs,photo,es,[0],-,MEX,"Villahermosa, Tabasco, Mexico",b'Se libera ocupaci\xc3\xb3n hospitalaria El director general de Epidemiolog\xc3\xada Jos\xc3\xa9 Luis Alom\xc3\xada inform\xc3\xb3 que son 738 mil 163 los casos confirmados de Covid-19 en M\xc3\xa9xico y 77 mil 163 muertos.Durante la conferencia de prensa de este martes 29 de se ... - https://t.co/krR6aHmNaV https://t.co/SyIwehQVKs',Mexico,"['Villahermosa, Centro, Tabasco']","[[18.0018152, -92.9330401483751]]"
1311139957424246791,1311139957424246791,2020-09-30 03:05:00,http://pbs.twimg.com/media/EjIazzgX0AMixAK.jpg,https://t.co/dt7yS7up9d,photo,es,[0],-,BRA,Buenos Aires,b'#Coronavirus: en casi 200 d\xc3\xadas de cuarentena:-Argentina super\xc3\xb3 a M\xc3\xa9xico y ya es el octavo pa\xc3\xads con m\xc3\xa1s casos en el mundo. -Est\xc3\xa1 en el puesto 122 en test realizados por mill\xc3\xb3n de habitantes. https://t.co/dt7yS7up9d',Brazil,"['Buenos, Boituva, Boituva, Região Imediata de Sorocaba, Região Metropolitana de Sorocaba, Região Geográfica Intermediária de Sorocaba, São Paulo, Região Sudeste', 'Buenos, Garza County, Texas', 'Buenos, Tarpon Point, Sarasota County, Florida', 'Buenos Aires, Comuna 6', 'Aires, Viù, Unione Montana Alpi Graie, Provincia di Torino, Piemonte', 'Aires, São João da Ponta, São João da Ponta, Microrregião de Salgado, Região Geográfica Intermediária de Castanhal, Pará, Região Norte', 'Aires, Alūksnes novads, Vidzeme']","[[-23.2622438, -47.720747], [33.2992595, -101.4876461], [27.035693, -82.270483], [-34.6075682, -58.4370894], [45.232178, 7.3864886], [-0.8801767, -47.9324683], [57.3643447, 27.5564899]]"
1311139878051217411,1311139878051217411,2020-09-30 03:04:41,http://pbs.twimg.com/media/EjIaxQfWkAE1CGC.jpg,https://t.co/fj2JiBYC9t,photo,en,[0],-,USA,"Philadelphia, PA",b'Trump-Biden Debate by Topic: Supreme Court COVID More https://t.co/LVgR8YxIPL https://t.co/fj2JiBYC9t',United States,"['Philadelphia, Philadelphia County, Pennsylvania', 'Philadelphia, Neshoba County, Mississippi', 'Philadelphia, Loudon County, Tennessee']","[[39.9527237, -75.1635262], [32.7703841, -89.1153488], [35.6795198, -84.4038148]]"
1311139843653550080,1311139843653550080,2020-09-30 03:04:33,http://pbs.twimg.com/media/EjIavVpUwAE4M3K.jpg,https://t.co/xerh6j942V,photo,es,[0],-,COL,,b'Hoy testeo de PCR para el coronavirus en el colegio Macaya https://t.co/yLoUiB3DPc https://t.co/xerh6j942V',Colombia,"['El Colegio, Cundinamarca']","[[4.5602690500000005, -74.42547978928478]]"
1311139818173235204,1311139818173235204,2020-09-30 03:04:27,http://pbs.twimg.com/media/EjIatnkWAAc8jlq.jpg,https://t.co/PtHixCO1CK,photo,es,[0],-,MEX,Michoacán de Ocampo,b'Michoac\xc3\xa1n Alimenta ejemplo de atenci\xc3\xb3n a sectores vulnerables ante COVID-19 https://t.co/AVDwl4EVCk https://t.co/PtHixCO1CK',Mexico,"['Michoacán de Ocampo', 'Michoacán, Jiquipilas, Chiapas', 'Michoacán, Villa Independencia, Pamparraza, Linares, Provincia de Linares, Región del Maule']","[[19.207098, -101.878113], [16.3710742, -93.7501358], [-35.8461714, -71.6163544]]"
1311139804537524224,1311139804537524224,2020-09-30 03:04:23,http://pbs.twimg.com/media/EjIasWGU8AA3f1P.jpg,https://t.co/Bl4KlxFqdl,photo,tl,[0],-,PHL,Baguio City,b'Rest in Paradise brother bestfriend LEGEND. Andami pa nating plano pag wala ng covid tol. Di parin ako makapaniwala sa nangyari. You always had my back at everything cant thank you enough for that. Iloveyou tol sobra\xe2\x9d\xa4\xef\xb8\x8f https://t.co/Bl4KlxFqdl',Philippines,"['Baguio, Benguet, Cordillera Administrative Region', 'Baguio, Davao City, Davao Region', 'Baguio, Tayabas, Quezon, Calabarzon']","[[16.412007, 120.5933937], [7.173743, 125.4019366], [14.0151726, 121.5860836]]"
1311139762347016192,1311139762347016192,2020-09-30 03:04:13,http://pbs.twimg.com/media/EjIaqIoUcAEkaVU.jpg,https://t.co/uDEV2RWS9l,photo,in,[0],-,FRA,,b'Operasi yustisi gabungan Satpol PP Koramil Gatak Polsek Gatak dan Dishub Kab. Skh kepada warga masyarakat yg berkendara roda dua maupun empat yg tdk mematuhi protokol kesehatan memakai masker dan jaga jarak guna mencegah penyebaran virus Covid 19 di wilayah Kecamatan Gatak. https://t.co/uDEV2RWS9l',France,"['Larodde, Issoire, Puy-de-Dôme, Auvergne-Rhône-Alpes, France métropolitaine', 'Doix, Doix-lès-Fontaines, Fontenay-le-Comte, Vendée, Pays de la Loire, France métropolitaine']","[[45.5256612, 2.5499931], [46.3932735, -0.8048412]]"
1311139676070133760,1311139676070133760,2020-09-30 03:03:53,http://pbs.twimg.com/media/EjIak7HU8AE_Cmm.jpg,https://t.co/1CSmtPoWI3,photo,es,[0],-,USA,En la tierra de Zapata,b'La diputada Tania Valentina del PT no quiso suspender sus actividades proselitistas y se contagi\xc3\xb3 de Covid. Servir\xc3\xa1 de lecci\xc3\xb3n para otros aspirantes. https://t.co/1CSmtPoWI3',United States,"['La Tierra, Shreveport, Caddo Parish, Louisiana']","[[32.4612649, -93.8710148]]"
